topic,correct_ending,incorrect_ending,sentence_1,sentence_2,sentence_3,sentence_4
Religious Holiday,"Rara seneng, dheweke bisa nggawe sedherek-babe seneng.","Rara ora duwe duwit, dheweke ora bisa njupuk ketupat.",Rara lan keluarga njupuk ketupat ing pasar,Ketupat iku panganan tradisional kanggo Lebaran,"Rara seneng banget, dheweke pengin njupuk ketupat kanggo sedherek-babe","Nalika njupuk, Rara weruh ketupat sing akeh banget"
Religious Holiday,Wisnu lan sedulur lanangane ngucapke matur suwun marang leluhure.,Wisnu ora bisa ngumpul karo sedulur lanangane.,Wisnu pengin nyekar ing kuburan leluhure nalika Lebaran,Dheweke arep ngajak kulawargane,"Sawise nyekar, dheweke arep ngumpul karo sedulur lanangane",Wisnu seneng banget nalika bisa ngumpul karo sedulur lanangane
Religious Holiday,Ning lan sedulur kandhane ngucapke matur suwun marang Gusti Allah.,Ning ora bisa ngumpul karo sedulur kandhane.,Ning kepingin nyiapake opor ayam nalika Lebaran,Dheweke arep ngajak anak lanang lan wedhokane nyetakake,Ning lan anak-anakne seneng banget nyetakake bareng,"Sawise nyetakake, dheweke arep ngumpul karo sedulur kandhane"
Religious Holiday,Bayu lan sedulur lanangane ngucapke matur suwun marang leluhure.,Bayu ora bisa ngumpul karo sedulur lanangane.,Bayu pengin ngajak kulawargane mudik nalika Lebaran,"Dheweke arep ngajak ibune, bapake, lan sedulur kandhane",Bayu seneng banget nalika bisa ngumpul karo sedulur kandhane,"Sawise ngumpul, dheweke arep ngajak sedulur lanangane dolan"
Religious Holiday,Tika lan keluarga padha tuku bumbu opor ing pasar.,Tika ora nggoleki bumbu opor maneh.,Tika lan keluarga padha nyiapake sedhapurane Lebaran,Tika seneng banget nyiapake opor ayam,Tika lan keluarga padha nggoleki bumbu kanggo opor,"Nanging, Tika lali tuku bumbu opor"
Religious Holiday,Bayu lan temen-temen padha njupuk sampah sendhiri.,Bayu lan temen-temen padha njaluk tulung marang wong ing kota.,Bayu lan temen-temen padha nyiapake acara sedekah bumi,Bayu padha nggoleki wong kanggo njupuk sampah ing kali,Temen-temen Bayu padha njaluk tulung marang wong ing sekitar,Warga sekitar ora gelem tulung
Religious Holiday,Rara lan keluarga padha tuku ing pasar sendhiri.,Rara lan keluarga ora nggoleki wong kanggo njupuk maneh.,Rara lan keluarga padha nyiapake acara slametan,Rara padha nggoleki wong kanggo njupuk ing pasar,Rara lan keluarga padha njaluk tulung marang tetangga,Tetangga ora gelem tulung
Religious Holiday,Siska seneng banget njupuk layang-layang.,Siska ora tau njupuk layang-layang.,Siska pengin njupuk layang-layang,Siska ora tau njupuk layang-layang,Siska tansah nyoba njupuk layang-layang,Siska ora putus asa
Religious Holiday,Rama ora lali nonton wayang kulit.,Rama ora tau nonton wayang kulit.,Rama arep nonton wayang kulit,Rama ora tau nonton wayang kulit,Rama tansah nonton wayang kulit,Rama seneng banget
Religious Holiday,Dika ora lali nyambut Lebaran.,Dika ora tau nyambut Lebaran.,Dika arep nyambut Lebaran,Dika tansah nyiapin opor ayam,Dika ora tau nyambut Lebaran,Dika seneng banget nyambut Lebaran
Religious Holiday,Rini nggawe kue sing luwih apik lan padha ngirim marang sedulure.,Joko ora bisa nggawe kue sing luwih apik.,Joko lan Rini padha seneng nggawe kue,"Saben lebaran, dheweke padha nggawe kue lan ngirim marang sedulure","Taun iki, Rini kepengin nggawe kue sing luwih apik",Dheweke arep nggawe kue sing luwih apik lan unik
Religious Holiday,"Muride padha semangat nyari kothak, lan akhirnya Wisnu sing nemokake.","Muride padha ora nemokake kothak, lan Pak Guru ora bisa nggawe lomba.","""Sapa sing duwe kothak iki?"" tanyane Pak Guru ing kelas",Muride padha ora ngerti,"""Kothak iki isine buku lan pulpen,"" wangsulane Pak Guru","""Aku arep nggawe lomba, sing bisa nemokake bakal dadi juara,"" tambahane"
Religious Holiday,Dheweke padha nyanyi lan pentasipun sukses.,"Selahe ora bisa nyanyi, lan Bagas ora bisa ngganti.",Selahe lan Bagas padha duwe hobi nembang,Dheweke padha nembang ing grup musik sekolah,"Taun iki, sekolah arep nggawe pentas seni",Selahe lan Bagas padha kepingin nyanyi ing pentas
Agriculture,Siska lan tetanggane nandur bareng lan nglakoni upacara mitoni.,Siska ora ngerti tradisi nandur lan ora nandur bareng karo tetanggane.,Siska pengin nandur padi ing sawah,Dheweke wis nyiapin benih lan pupuk,Siska arep nandur bareng karo tetanggane,Siska seneng banget karo tradisi nandur
Agriculture,Cah cilik iku metik asem lan ngasihake bapakne.,Aseme wis dicuri lan cah cilik iku ora metik maneh.,"Wis wengi, cah cilik iku munggah ing pohon asem",Dheweke pengin metik asem kanggo bapakne,Aseme wis gedhe lan mateng,Cah cilik iku seneng banget metik asem
Agriculture,Pak Warno lan wong desane panen bareng lan nglakoni upacara panen.,Pak Warno ora ngerti cara panen lan ora nglakoni upacara.,Pak Warno duwe kebon sing gedhe,Dheweke nandur angsri lan manggis,Panen manggis iku wis dekat,Pak Warno seneng banget nandur lan ngurus kebon
Agriculture,Joko ora putus asa lan nyoba manemoni lan ngerti cara sing bener.,Joko ora ngerti apa sing salah lan ora nyoba manemoni maneh.,Joko arep njajal tanam jagung ing pekarangan,"Ing wulan wingi, dheweke wis tanam padi lan panen",Dheweke pengen njajal tanam panganan liya,Tanaman jagunge ora tumuwuh
Agriculture,Sinta lan kanca-kancane ora putus asa lan nyoba manemoni maneh.,Sinta ora ngerti carane lan ora nyoba manemoni maneh.,Sinta lan kanca-kancane arep njajal tanam padi,Sinta ora tau carane tanam padi,Kanca-kancane Sinta ngajeni carane,Sinta ora bisa njaga tanaman lan padha mati
Agriculture,Bayu ora putus asa lan nyoba manemoni maneh.,Bayu ora ngerti carane lan ora nyoba manemoni maneh.,Bayu pengen njajal tanam sayur ing pekarangan,Bayu ora tau carane tanam sayur,Bayu nyoba nanya karo tetanggane,Tanaman sayure ora tumuwuh
Agriculture,"Bapake ngerti, lan ngajak Joko nyoba tanam sayur.","Joko dipaksa bapake, lan tanamane gagal maning.","""Lho, kok arep tanam jagung maning, Pak?"" tanyane Joko marang bapake",Bapake Joko seneng banget karo jagung,"""Lho, kan wis musim tanam jagung, Jaka","Ayo, tulungi bapak,"" bapake ngajak"
Agriculture,Sri ngerti budaya ngucapke terima kasih ing wong sing nolongi.,"Sri ora ngerti, lan ora nyambut tamu.",Sri lagi nyambut tamu ing pendhapa,"""Iki tamu sapa, Bu?"" tanyane","""Iki Pak Lurah lan keluarga, sing arep ngucapke matur nuwun,"" jawab ibune","Sri langsung ngerti, soale taun wingi bapake nolongi Pak Lurah"
Agriculture,Tika ngerti lan ora ngajak adane maning.,"Adane dipaksa, lan ora doyan maning.","""Kowe wis tau nyoba ngombe kopi, to, Mas?"" tanyane Tika marang adane","""Belum, aku seneng teh,"" jawab adane","""Ayo, nyobak, aku wis ngombe, enak kok,"" Tika ngajak","Adane ora gelem, soale wis tau nyoba lan ora doyan"
Agriculture,Sinta nandur sayur lan buah kanggo wong tuwa.,Sinta ngasi wong tuwa duwit kanggo tuku panganan.,Sinta pengin banget nolongi wong tuwa ing desane,Sinta ngerti yen wong tuwa iku luwih gampang lemes,Sinta pengin ngasi wong tuwa panganan sehat,Sinta arep nandur panganan sehat kanggo wong tuwa
Agriculture,Budi njaluk tulung marang tetanggane kanggo nandur padi.,"Budi mboten wonten nandur padi, mung tuku ing pasar.",Budi pengin nandur padi,Budi ora ngerti carane nandur padi,Budi mboten wonten pengalaman nandur padi,Budi pengin nandur padi kanggo panganan keluarga
Agriculture,Tika njaluk tulung marang tetanggane kanggo nandur bunga.,"Tika mboten wonten nandur bunga, mung tuku ing toko.",Tika pengin nandur bunga,Tika ora ngerti carane nandur bunga,Tika pengin nandur bunga kanggo hiasan ing omah,Tika pengin nandur bunga kanggo ngasi hadiah marang temen
Agriculture,Pak Budi lan tetanggane ngerti yen watu iku bagian saka situs purbakala.,Pak Budi lan tetanggene ngangkat watu iku lan nemokake harta karun.,"Selahe nggarap sawah, Pak Budi nemokake watu gedhe ing tengah sawah","Sawise ditelusuri, watu iku ana tulisan Jawa kuno",Pak Budi ngajak tetanggane kanggo ngangkat watu iku,"Nanging, watu iku akeh banget lan ora iso diangkat"
Agriculture,Mbak Sinta lan temen-temen kuliah ngerti yen sampah plastik iku apik dadi inggih dadi sampah.,Mbak Sinta lan temen-temen kuliah nggoleki bungkus plastik iku lan nemokake duit.,"Ning rumiyin, Mbak Sinta lan temen-temen kuliah njupuk sampah plastik ing sawah","Sambil njupuk sampah, dheweke ngobrol ngalor-ngidul","Ning tengah sawah, dheweke nemokake bungkus plastik sing apik",Mbak Sinta lan temen-temen isin nggoleki bungkus plastik iku
Agriculture,Pak Slamet ngerti lan ora ngajak Pak Joko piknik.,Pak Slamet ngajak Pak Joko lan keluarga piknik.,Pak Joko lan Pak Slamet ngobrol nang sawah,"Pak Slamet ngomong yen sawise panen, dheweke arep ngajak anak-anak lan istri piknik",Pak Joko ngajak Pak Slamet kanggo ngobrol nang sawah,Pak Slamet ngerti yen Pak Joko ora duwe duwit
Agriculture,Sela mboten wonten benih padi kanggo ditanami.,Sela ora duwe benih padi.,Sela duwe sawah sing gedhe,Sela pengin tanam padi,Sela ora duwe benih padi,Sela mboten wonten benih padi kanggo ditanami
Agriculture,Wulan mboten wonten benih bunga kanggo ditanami.,Wulan ora duwe benih bunga.,Wulan duwe kebun sing apik,Wulan pengin tanam bunga,Wulan ora duwe benih bunga,Wulan mboten wonten benih bunga kanggo ditanami
Agriculture,Bayu mboten wonten benih jagung kanggo ditanami.,Bayu ora duwe benih jagung.,Bayu duwe lahan sing luas,Bayu pengin tanam jagung,Bayu ora duwe benih jagung,Bayu mboten wonten benih jagung kanggo ditanami
Agriculture,Suto lan kanca-kancane padha nandur padi marang sawah.,Suto lan kanca-kancane padha nandur jagung.,Suto ngajak kanca-kancane nang sawah,Suto arep nandur padi,Suto lan kanca-kancane padha ngumpul ing sawah,Suto lan kanca-kancane padha nandur padi
Agriculture,Ning rumiyin padha nandur padi marang sawah.,Ning rumiyin padha nandur jagung marang sawah.,Ning rumiyin arep nandur padi,Ning rumiyin padha nandur ing sawah,Ning rumiyin padha nandur marang sawah,Ning rumiyin padha nandur padi marang sawah
Agriculture,Wulan padha nandur padi marang sawah.,Wulan padha nandur jagung marang sawah.,Wulan arep nandur padi,Wulan padha nandur ing sawah,Wulan padha nandur marang sawah,Wulan padha nandur padi marang sawah
Agriculture,"Joko ora tau mitoni, dheweke padha njaga sawah.","Joko padha njaga tradisi, mitoni iku penting.",Wisma ing desane Joko kudu direhab,"Ing desane Joko, wong tuwa padha nindakake tradisi mitoni",Mitoni iku ritual kanggo njaga supaya panen padha subur,"Joko ora tau mitoni, dheweke padha njaga sawah"
Agriculture,Tono minta maaf lan nggarap bareng Joko.,Joko nggarap sendirian lan ora njaluk tulung maneh.,"Joko ngerti kancane, Tono, arep nyuwun tulung nggarap sawah",Tono wis janji bakal nuntun Joko nggarap,"Nanging pas dina sing dijanjike, Tono ora teka",Joko bingung lan ora ngerti piye carane nggarap sawah sendirian
Agriculture,Sri ngucapke sukra marang Gusti Allah lan tetep semangat nggarap.,Sri ora ngucapke sukra lan nggarap karo bangga.,Sri pengin nyoba tanam padi saka benih sing anyar,Dheweke wis baca buku lan nonton video ngegalake carane,Sri nggarap sawah lan nyoba tanam benih anyar iku,Panenan sing kasil akeh banget lan Sri seneng
Agriculture,Budi lan kanca-kancane tetep ngadain acara lan ngucapke sukra marang Gusti Allah.,Budi lan panitia ora ngadain acara lan ngucapke sukra.,Budi lan kanca-kancane arep ngadain sedekah bumi,Dheweke ngajak wong-wong desa ngumpul lan nyumbang panganan,Panitia wis nyiapin wadah lan panganan sing bakal disedekake,"Nanging pas dina sedekah bumi, akeh sing ora teka"
Agriculture,Pak Budi nggawe segehan anyar lan nggawe segehan lawas marang tetanggane.,Pak Budi ngganti segehan iku karo segehan sing luwih apik.,"Selahe nggarap sawah, Pak Budi nemokake segehan ing tengah sawah",Segehan iku isih apik lan utuh,Pak Budi ora tau ngerti sapa sing nggawe segehan,Pak Budi kepingin ngganti segehan iku
Agriculture,Pak Joko ngajak tetanggane nggarap kebon bareng lan nggawe sistem irigasi anyar.,Pak Joko ngganti tanaman ing kebone karo tanaman sing luwih produktif.,"Ning rumiyin, Pak Joko duwe kebon sing apik",Kebone isih dadi sumber rejeki lan pangan,"Ning saiki, kebone Pak Joko ora bisa ngasilake pangan kaya biyen",Pak Joko kepingin nggawe kebon sing luwih apik
Agriculture,Mbak Rini nanya marang sesepuh desa lan ngikuti tradisi nggarap sawah.,Mbak Rini ora ngerti tradisi iku lan nggarap sawah kaya biasa.,"Dina iki, Mbak Rini arep nggarap sawah bareng kulawargane",Sawah iku duwe tradisi khusus nalika nggarap,Mbak Rini ora tau tradisi iku,Mbak Rini kepingin ngerti tradisi nggarap sawah
Agriculture,Joko lan kanca-kancane ngucapke sukur marang Gusti Allah.,"Joko ora ngucapke sukur, padahal panenan sukses.",Joko ngajak kanca-kancane nandur padi ing sawah,Sing ngumpul padha bener nggarap sawah,Panenan padha sukses lan hasilne melimpah,Joko seneng lan bangga
Agriculture,Sinta ngucapke sukur marang Gusti lan kanca-kancane.,"Sinta ora ngucapke sukur, padahal jagung padha tumbuh.",Sinta lan kanca-kancane nandur jagung,"Sinta ora tau nandur jagung, tapi kanca-kancane padha ngajari",Sinta lan kanca-kancane padha nandur bareng,Sinta seneng lan bangga
Agriculture,Budi lan kanca-kancane ngucapke sukur marang Gusti lan bumi.,"Budi ora ngucapke sukur, padahal panenan kedelai apik.",Budi lan kanca-kancane nandur kedelai,"Budi wis tau nandur, tapi kanca-kancane padha minta bantuan",Panenan kedelai padha sukses lan hasilne apik,Budi seneng lan bangga
Agriculture,"Watu e ilang saka karo, lan Joko ora weruh.","Joko nemokake watu e ana ing dalan, lan dheweke seneng.",Joko pengin njupuk watu kanggo nguripi sawah,"Nanging, sawise dhekem, watu e ora ana",Joko ngira watu e ilang,Joko kaget nalika weruh watu e ana ing dalan
Agriculture,Sinta ora ngerti yen banyu sawah ora layak diombe.,Rama ngijini Sinta ngombe banyu sawah.,Sinta lan Rama nglangi ing sawah,Sinta ngombe banyu sawah,Rama ora ngijini Sinta ngombe banyu,Sinta ora ngerti babagan tradisi
Agriculture,"Tiwul e dianggo wong liyo, lan Wisnu ora weruh.",Tiwul e ketemu ing dapur.,Wisnu pengin njupuk tiwul kanggo sarapan,Tiwul e wis mateng,"Nanging, nalika dianggo, Tiwul e ora ana",Wisnu ora ngerti apa sing salah
Agriculture,Joko lan bapake padha ngerti yen butuh sabar lan waktune luwih saka siji musim tanam.,Joko ngira yen tanam padi iku gampang.,Joko pengin njajal tanam padi ing sawah,Dheweke padha njupuk benih karo bapake,"Sawise tanam, Joko ora sabar nunggu panen",Panene ora kasil kaya ngono
Agriculture,Sinta lan temen-temené padha njupuk maneh benih sing bener.,Sinta ora ngerti yen benih iku ora cocok kanggo tanam ing daerahé.,Sinta lan temen-temené padha njupuk benih ing pasar,"Suka, Sinta nemu benih sing aneh",Sinta ora ngerti jenenge,Sinta padha tanam benih iku
Agriculture,Bayu padha ngerti yen sayur iku butuh perawatan khusus.,Bayu ora peduli karo wejangane wong tuwane.,Bayu lan wong tuwane padha njupuk benih sayur,Bayu pengin njajal tanam sawi,Wong tuwane ngingetin yen sayur iku butuh perawatan,Bayu ora ngerti lan padha tanam
Agriculture,Joko lan wong tuwane padha ngucapke sukur ing dalem atine.,"Joko ora ngucapke sukur, padahal wong tuwane wis ngasih petunjuk.",Joko pengin nyoba nandur padi ing sawah e,"Sawise nandur, Joko minta restu marang wong tuwane",Wong tuwane ngasih petunjuk kanggo ngrawit sawah,Joko lan wong tuwane padha njupuk cangkul lan ngrawit
Agriculture,"Sinta ora nandur maneh, dheweke luwih seneng nandur kembang.",Sinta nandur jagung lan dadi petani sukses.,Sinta lan wong tuwane padha nandur jagung,Sinta nandur jagung kanggo ngisi waktune,Wong tuwane ngasih petunjuk kanggo nandur,Sinta ora ngerti carane nandur
Agriculture,"Wulan ora nandur maneh, dheweke luwih seneng nandur sayur.",Wulan nandur ketela lan dadi petani sukses.,Wulan lan wong tuwane padha nandur ketela,Wulan nandur ketela kanggo ngisi waktune,Wong tuwane ngasih petunjuk kanggo nandur,Wulan ora ngerti carane nandur
Agriculture,Ratih njaluk tulung marang tetanggane kang wis pengalaman.,Ratih ora gelem njaluk tulung marang wong liyo.,Ratih pengin njajal tanam padi,Ratih ora tau carane,Ratih mboten ngertos carane njaga,Tanamane mati
Agriculture,Gita njaluk tulung marang wong tuwane.,Gita ora gelem njaluk tulung marang wong liyo.,Gita njaluk bantuan marang wong tuwane,Gita pengin njajal tanam jagung,Gita ora tau carane,Gita ora tau carane ngolah
Agriculture,Siska ora weruh yen tetanggane wis tuwa.,Siska weruh yen tetanggane wis tuwa.,Siska pengin tanam padi,Siska ora ngerti carane,Siska minta bantuan tetanggane,Siska ora weruh yen tetanggane wis tuwa
Agriculture,Bayu ora weruh yen wis telat.,Bayu weruh yen wis telat.,Bayu dadi petani,Bayu ora weruh yen musim tanam wis entuk,Bayu ora ngerti carane ngolah sawah,Bayu ora weruh yen wis telat
Agriculture,Ratih ora weruh yen wis telat.,Ratih weruh yen wis telat.,Ratih dadi petani,Ratih ora weruh yen musim tanam wis entuk,Ratih ora ngerti carane ngolah sawah,Ratih ora weruh yen wis telat
Agriculture,Joko njaluk tulung marang wong tuwane.,Joko ora ngerti carane ngolah panenane.,Joko pengin njajal tanam padi,Panenan padine Joko luwih akeh,Joko ora ngerti carane ngolah,Panenane Joko ora bisa diolah
Agriculture,Sela njaluk tulung marang wong tuwane.,Sela ora gelem nggawe janur maneh.,Sela nggawe janur ing pendhapa,Sela ora ngerti carane nggawe janur,Sela nyoba nggawe janur maneh,Janur sing digawe Sela ora apik
Agriculture,Wulan njaluk tulung marang wong tuwane.,Wulan ora ngerti carane ngolah jagung.,Wulan pengin njajal tanam jagung,Wulan ora ngerti carane ngolah jagung,Wulan nyoba ngolah jagung maneh,Jagung sing diolah Wulan ora apik
Agriculture,"Joko mboten usah njupuk mangga, menawi manggane luwih gedhe saka tingginya.",Joko ngajak kanca-kancane kanggo njupuk mangga.,Joko pengin njupuk buah mangga sing wis mateng,"Nanging, manggane luwih gedhe saka tingginya",Joko ora duwe tangga kanggo njupuk,Joko isih cilik
Agriculture,"Sri lan Sari mboten usah njupuk rambutan, menawi rambutane luwih gedhe saka tingginya.",Sri lan Sari ngajak kanca-kancane kanggo njupuk rambutan.,Sri lan Sari pengin njupuk buah rambutan,Rambutane luwih gedhe saka tingginya,Sri lan Sari ora duwe tangga kanggo njupuk,Sri lan Sari isih cilik
Agriculture,"Budi mboten usah njupuk duren, menawi durene luwih gedhe saka tingginya.",Budi ngajak kanca-kancane kanggo njupuk duren.,Budi pengin njupuk buah duren,"Nanging, durene luwih gedhe saka tingginya",Budi ora duwe tangga kanggo njupuk,Budi isih cilik
Agriculture,Yanto saiki padha nandur lan nuli bareng Joko.,Joko saiki padha nandur lan nuli bareng Yanto.,Joko lan Yanto padha duwe sawah ing desane,Sawah iku diwarisi saka bapakne,"Saking padha-padhane, wonten sae lan ora sae",Joko sae nandur lan Yanto ora sae nandur
Agriculture,Ratih saiki padha nandur lan nuli bareng Sinta.,Sinta saiki padha nandur lan nuli bareng Ratih.,Sinta lan Ratih padha duwe kebon,Sinta nandur sayur lan Ratih nandur buah,"Saking padha-padhane, wonten sae lan ora sae",Sinta sae nandur lan Ratih ora sae nandur
Agriculture,Wati saiki padha nandur lan nuli bareng Budi.,Budi saiki padha nandur lan nuli bareng Wati.,Budi lan Wati padha duwe ladang,Budi nandur jagung lan Wati nandur padi,"Saking padha-padhane, wonten sae lan ora sae",Budi sae nandur lan Wati ora sae nandur
Agriculture,Sela lan keluarga padha ngucapke panuwun marang Gusti Allah kanggo panenan sing apik.,Sela ora ngucapke panuwun marang wong tuwane.,Sela wis nyiapin benih lan lahan kanggo nandur padi,Sela lan keluarga padha ngumpul kanggo nandur bareng,"Sawise nandur, Sela lan keluarga padha nglakoni ritual slametan",Sela ora lali ngucapke pamrih lan panuwun
Agriculture,Joko ngucapke panuwun marang kanca-kancane kanggo bantuane.,Joko ora ngucapke panuwun marang sapa-sapa.,Joko lan kanca-kancane padha nandur pohon jati,"Sawise nandur, Joko lan kanca-kancane padha slametan",Slametan iku nglakoni ritual ngucapke panuwun marang leluhur,Joko ora ngucapke panuwun marang kanca-kancane
Agriculture,Ratih ngucapke panuwun marang wong tuwane kanggo bantuane.,Ratih ora ngucapke panuwun marang sapa-sapa.,Ratih lan keluarga padha nandur jagung,"Sawise nandur, Ratih lan keluarga padha slametan",Slametan iku nglakoni ritual ngucapke panuwun marang Gusti Allah,Ratih ora ngucapke panuwun marang wong tuwane
Agriculture,Joko njaluk bantuan karo tetanggane kang wis pengalaman nyanggane.,Joko putus asa lan ora nyoba manang nyanggane maneh.,Joko pengin nyoba tanam padi,Dheweke wis baca buku lan nonton video bab cara nyanggane,Joko ora tau kudu mulai saka endi,Dheweke bingung lan ora tau kudu njaluk bantuan sapa
Agriculture,Sri njaluk saran karo tetanggene kang wis pengalaman nyanggane.,Sri ora tau kudu njaluk bantuan sapa.,Sri pengin nyoba tanam bunga,Dheweke wis siapake benih lan pupuk,Sri ora tau kapan saat sing pas kanggo tanam,Dheweke bingung lan ora tau kudu njaluk saran sapa
Agriculture,Bayu njaluk bantuan karo tetanggene kang wis pengalaman nyanggane.,Bayu ora tau kudu ngombe opo nalika nyanggane.,Bayu pengin nyoba tanam sayur,Dheweke wis siapake lahan lan benih,Bayu ora tau kudu ngombe opo nalika nyanggane,Dheweke bingung lan ora tau kudu njaluk bantuan sapa
Agriculture,Sela ora bisa nandur padi.,Sela njaluk benih marang bapake.,Sela arep nandur padi ing sawah,Sela ora duwe benih padi,Sela njaluk benih marang tetanggane,Tetanggane Sela ora duwe benih marang Sela
Agriculture,Rini ngajak wong tuwa ngobrol.,Rini ora nandur maneh.,Rini arep nandur jagung ing pekarangan,Rini wis nandur benih lan nguripi,Rini nunggu benih jagung tumuwuh,Rini ora sabar nunggu lan ora duwe wong kanggo ngobrol
Agriculture,Bayu njaluk bantuan marang bapake.,Bayu ora nandur pohon maneh.,Bayu arep nandur pohon ing pekarangan,Bayu ora duwe wektu kanggo nguripi,Bayu njaluk bantuan marang kanca-kancane,Kanca-kancane Bayu ora bisa nolong
Agriculture,Joko lan sedulur-sedulure ngucapke sukur marang Gusti Kang Murbeng Dumadi.,Joko lan sedulur-sedulure nyambut gawe tanam padi.,Joko pengin tanam padi ing sawah,"Ing dina tanam, Joko lan sedulur-sedulure ngadhekani sesajen",Sesajen iku kanthi nyuwun pangapura marang Dewi Sri,Sawah lan lingkungane mesthi disucikan
Agriculture,Sinta lan temen-temen sekolah ngucapke sukur marang Gusti Kang Murbeng Dumadi.,Sinta lan temen-temen sekolah ngumpulake kangkung kanggo petani.,Sinta lan temen-temen sekolah arep nolongi petani,Panen kangkung ing musim kemarau iku ora gampang,Sinta lan temen-temen sekolah arep ngumpulake kangkung kanggo petani,Kangkung iku sayur sing gampang diternakake
Agriculture,Pak Warto lan anak-anak ngucapke sukur marang Gusti Kang Murbeng Dumadi.,Pak Warto lan anak-anak njupuk kopi ing kebun.,"""Dina iki aku arep njupuk kopi,"" omonge Pak Warto marang anak-anak",Pak Warto lan anak-anak arep njupuk kopi ing kebun,Kopi iku salah sijine tanaman sing diwarasake Pak Warto,"""Aku arep ngajak kalian njupuk kopi,"" tambah Pak Warto"
Agriculture,Joko njaluk bantuan marang tetanggane lan padha njagong sawahe bareng-bareng.,Joko ora bisa njagong sawahe amarga ora duwe kanca.,Joko arep njagong sawah,Dheweke padha njaluk bantuan marang kanca-kancane,Kanca-kancane padha ora duwe wektu,Joko ora bisa njagong sawahe
Agriculture,Sinta njaluk bantuan marang wong tuwane lan padha njagong sawahe bareng-bareng.,Sinta ora bisa njagong sawahe amarga ora duwe pengalaman.,Sinta ora duwe pengalaman njagong,Dheweke arep njagong sawahe bapake,Bapake Sinta ora percaya karo kemampuan Sinta,Sinta ora bisa njagong sawahe
Agriculture,Bayu njaluk bantuan marang wong desane lan padha njagong sawahe bareng-bareng.,Bayu ora bisa njagong sawahe amarga ora duwe alat.,Bayu arep njagong sawahe,Dheweke ora duwe alat-alat njagong,Bayu njaluk pinjaman alat marang tetanggane,Tetanggane ora bisa minjemi alat
Agriculture,"Panene kasil, tapi ora nganti.",Sawane ora cocog kanggo tanam padi.,Wisnu pengin tanam padi ing sawah,Sawane wis siap,Wisnu lan sedulur-sedulure mulai tanam,Panene ora kasil
Agriculture,"Sawahipun kasil, tapi ora nganti.",Ratih lan sedulur-sedulure ora ngerti carane nggarap sawah.,Ratih lan sedulur-sedulure arep nggarap sawah,Sawahipun wis siap,Ratih lan sedulur-sedulure mulai nggarap,Sawahipun ora kasil
Agriculture,"Kebunipun kasil, tapi ora nganti.",Bayu lan sedulur-sedulure ora ngerti carane nggarap kebun.,Bayu lan sedulur-sedulure arep nggarap kebun,Kebunipun wis siap,Bayu lan sedulur-sedulure mulai nggarap,Kebunipun ora kasil
Agriculture,"Suto ora duwe sawah, nambak iku kudu sabar.","Suto tuku sawah, nambak iku gampang.",Suto ora duwe sawah,Suto pengin banget nambak,Suto ora duwe duwit kanggo tuku sawah,Suto arep ngutang marang tetanggane
Agriculture,"Sri ora duwe benih padi, tanam padi iku kudu persiapan.","Sri tuku benih padi, tanam padi iku gampang.",Sri duwe sawah sing gedhe,Sri pengin tanam padi,Sri ora duwe benih padi,Sri arep tuku benih padi ing pasar
Agriculture,"Joko ora duwe benih jagung, tanam jagung iku kudu sabar.","Joko tuku benih jagung, tanam jagung iku gampang.",Joko duwe sawah sing apik,Joko pengin tanam jagung,Joko ora duwe benih jagung,Joko arep tuku benih jagung ing pasar
Agriculture,Siska lan keluarga ngrasakake manfaat saka usaha anyar.,Bapake Siska ora ngijini Siska lan keluarga njajal usaha anyar.,Siska pengin njajal tanam padi,Siska lan keluarga arep njajal usaha anyar,Siska njaluk ijin marang bapake,Bapake Siska duwe sawah sing luwih saka 5 hektar
Agriculture,Rendi lan temen-temen sekolah dadi wirausahawan sukses.,Rendi lan temen-temen sekolah ora bisa njajal usaha anyar.,Rendi lan temen-temen sekolah arep njajal tanam jagung,Rendi lan temen-temen sekolah arep njajal usaha anyar,Rendi lan temen-temen sekolah njaluk ijin marang guru,Guru sekolah ngijini Rendi lan temen-temen sekolah njajal usaha anyar
Agriculture,Nabila lan keluarga dadi wirausahawan sukses.,Bapake Nabila ora ngijini Nabila lan keluarga njajal usaha anyar.,Nabila kepengin njajal tanam bawang,Nabila lan keluarga arep njajal usaha anyar,Nabila lan keluarga njaluk ijin marang bapake,Bapake Nabila duwe lahan sing luwih saka 10 hektar
