topic,correct_ending,incorrect_ending,sentence_1,sentence_2,sentence_3,sentence_4
Pregnancy and Kids,Kiwi tiasa ngajari kodrat jumeneng sareng kasucian kayahan kalayan saé.,Kiwi nggawe anak-anakna ngomong kasucian kayahan.,Kiwi manggupakeun ngagendhuak sareng anak-anakna,Kiwi ngajari anak-anakna kodrat jumeneng,Kiwi tiasa nandur diparentosan saé,"Sementara éta, Kiwi ngomong-ngomong kasucian kayahan"
Pregnancy and Kids,Ayu tiasa nandur diparentosan sareng ngajari wiwitan urang Sunda kalayan saé.,Ayu nggeruksakeun wiwitan urang Sunda sarta nandur diparentosan.,Ayu kudu nandur diparentosan,Ayu ngajari wiwitan urang Sunda,Ayu manggenep paranti,Ayu kudu nandur diparentosan saé
Pregnancy and Kids,Rani tiasa nandur diparentosan sareng ngajari wiwitan urang Sunda sarta nyajual hasil pagawéanana.,Rani ngajual barang-barang bekas sareng nggawe panganti.,"Dina ngumpulkeun barang-barang bekas, Rani kudu nyambut panganti",Rani ngajari wiwitan urang Sunda,Rani tiasa nandur diparentosan saé,"Sementara éta, Rani ngabersihkeun barang-barang bekas kana acan dijual kana rumanana"
Pregnancy and Kids,Mbak Maria tiasa nandur diparentosan sareng ngajari wiwitan urang Sunda kalayan saé.,Mbak Maria nggeruksakeun wiwitan urang Sunda sarta nandur diparentosan.,Mbak Maria kudu nandur diparentosan,Mbak Maria ngajari wiwitan urang Sunda,Mbak Maria kudu nandur diparentosan saé,"Sementara éta, Mbak Maria manggenep paranti urang Sunda"
Pregnancy and Kids,Saida manggaran dina kecurangan sarta ngajah ka kodratna.,Ade manggulah ka namanéhna kala urip sarta ngandika ka kawula-wulan.,"Dina waktu kauratna, Ade teu kumaha ka uripna",Ade mamiharip ka kepercayaan ka Dewa,Ade nyanjih kawula-wulan kaselamatan ka anakna,Ade teu nyandika ka namanéhna kala urip
Pregnancy and Kids,Ade manggulah ka namanéhna kala urip sarta ngajah ka kepercayaan ka Dewa.,Ayu ngandika ka kecurangan sarta ngandika ka rancangan ka pengasihan.,Ayu nanggap ka kebersamaan ka bibinya sarta manggempon ka kehidupan ka anakna,Ayu ngandika ka rancangan ka pengasihan ka bibinya,Ayu teu kumaha ka kecurangan,Ayu teu kumaha ka sidelpan
Pregnancy and Kids,Ayu manggempon ka kehidupan ka anakna sarta ngajah ka kebersamaan ka bibinya.,Pramono ngandika ka kecurangan sarta ngandika ka panglimaan ka istrihinya.,Pramono mamiharip ka kodratna dina hamil,Pramono manggempon ka kehidupan ka anakna,Pramono manggempon ka panglimaan ka istrihinya,Pramono teu kumaha ka kecurangan
Pregnancy and Kids,Pramono manggempon ka kehidupan ka anakna sarta ngajah ka panglimaan ka istrihinya.,Lila ngandika ka kecurangan sarta ngandika ka rancangan ka pembinaan ka keluarganya.,Lila teu kumaha ka uripna,Lila mamiharip ka kepercayaan ka Dewa,Lila ngandika ka rancangan ka pembinaan ka keluarganya,Lila teu kumaha ka kecurangan
Pregnancy and Kids,Éta ngasih makanan sakaréa.,Méla ngasih rancangan dénténg nu maméntéh jerita.,Méla ku inget sasana nu nganti anak nu méranti,Méla ngasih rancangan dénténg nu maméntéh éta,Éta pepadhanan nu léwihin éta kadaharan nu séhat,"Tanpa sadaya, Méla ngasih rancangan dénténg nu maméntéh éta"
Death,"Setelah ditempatkan di tempat pemakaman, mereka melakukan upacara membaca Al-Quran.",Mereka melakukan upacara pemberian hadiah.,Budi meninggal karena sakit,Istri Budi membeli baju hitam untuk digunakan saat perayaan hari mati,Anak-anak Budi memakai baju putih,Mereka bersama-sama melakukan upacara membaca Al-Quran di rumah
Death,"Setelah upacara selesai, mayat Budi diangkut ke tempat pemakaman.",Mereka melakukan upacara pemberian hadiah.,Santoso telah meninggal karena kecelakaan,Keluarganya memilih untuk mengubur mayat di kuburan tradisional,Mereka menggunakan kaos putih selama upacara pemakaman,"Setelah itu, mayat diangkut ke tempat pemakaman dengan gerongan"
Death,"Setelah ditempatkan di tempat pemakaman, mereka melakukan upacara membaca Al-Quran.",Mereka melakukan upacara pemberian hadiah.,Yani meninggal karena penyakit jantung,Keluarga Yani bersama-sama melakukan upacara membaca Al-Quran di rumah,"Setelah itu, mayat diangkut ke tempat pemakaman",Mereka berkumpul lagi di rumah keluarga Yani untuk makan bersama
Death,Era manggaing ka rumah mangadep saranan wong suci.,Raka ngomong kabar suka cacah anaknya ka teman-teman.,"Raka manggaing ka rumah kaget, nalika ngajalang ka tedakan","Raka teu tiasa ningali ka tedakan, langsung ngajalang ka alun-alun",Raka nangis karep kabar suka cacah anaknya,"Raka nangingal manggaing ka rumah kaget, jarang teu kabar suka cacah anaknya"
Death,Raka manggaing ka rumah mangadep saranan anaknya.,Nana ngomong kabar anaknya teu sok ka teman-teman.,Nana manggaing ka bakulan sabarana teu sok,"Nana teu tiasa ningali ka bakulan, langsung nyusup ka rumah",Nana ngagongsi kabar anaknya teu sok,"Nana nangingal manggaing ka bakulan kaget, jarang teu kabar anaknya teu sok"
Death,Nana manggaing ka rumah mangadep saranan anaknya.,Dedi ngomong kabar mati cacah neneknya ka teman-teman.,Dedi ngajalang ka kuburan manggaing ka batu neneknya,"Dedi teu tiasa ningali ka kuburan, langsung nangingal ngajalang",Dedi nangis karep kabar mati cacah neneknya,"Dedi nangingal manggaing ka kuburan kaget, jarang teu kabar mati cacah neneknya"
Death,Dedi manggaing ka rumah mangadep saranan neneknya.,Siti ngomong kabar cacah bapaknya ka teman-teman.,"Siti manggaing ka rumah kaget, nalika ngajalang ka bak mandi","Siti teu tiasa ningali ka bak mandi, langsung ngajalang ka alun-alun",Siti ngagongsi kabar cacah bapaknya,"Siti nangingal manggaing ka rumah kaget, jarang teu kabar cacah bapaknya"
Religious Holiday,Ngasir dipandeng sakola pasca sidak.,Dewi suka ngajual jajanan tradisional Waisak karena mboten suka pujaan Budha.,"Sapertos hari raya Waisak, Dewi suka ngagelar pujaan Budha",Dewi ngadeg sareng saudara-saudaranya pujaan Budha di pagongan,Dewi nganggo ngaji kabar Budha,Dewi ngajual jajanan tradisional Waisak
Religious Holiday,Dewi merasa damai setelah pujaan Budha.,Santosa nakilet ke rumah teman karena mboten ngerti arti Natal.,"Sapertos hari raya Christmas, Santosa mboten ngerti arti Natal",Santosa nakilet ke rumah teman,Santosa nganggo pesta Natal,Santosa nganggo ngaji tentang arti Natal
Religious Holiday,Santosa ngerti arti Natal setelah ngaji.,Hendri ngajual jajanan tradisional Eid al-Adha karena mboten ngerti tradisi Korban.,"Sapertos hari raya Eid al-Adha, Hendri mboten ngerti tradisi Korban",Hendri nganggo rumah tangga suka,Hendri ngadeg sareng saudara-saudaranya,Hendri ngajual jajanan tradisional Eid al-Adha
Religious Holiday,Hendri ngerti tradisi Korban setelah ngadeg sareng saudara-saudaranya.,Sari ngajual jajanan tradisional Diwali karena mboten ngerti arti Diwali.,"Sapertos hari raya Diwali, Sari mboten ngerti arti Diwali",Sari nganggo pelataran Diwali,Sari ngadeg sareng saudara-saudaranya,Sari ngajual jajanan tradisional Diwali
Agriculture,Sari manggalaksonan seken sareng tani.,Budi nyambung sikap hajatna nganggo sajatro.,Budi kaburan kagiatan ngabolang,Budi kudu bisa nyambung sikap hajat,Budi kasungut sambungan ka kawula,Budi teu ada rasa ngadep
Agriculture,Budi bisa manggalaksonan hajat sambungan ka kawula.,Dewi ngajani kapanggihan tanaman sajatro.,Dewi mangajani tanaman jagung,Dewi kasungut kapanggihan tanaman,Dewi ngajani kawula,Dewi teu gaé ngajani sikeun
Agriculture,Dewi manggalaksonan ngajani sikulaksa kawula.,Santosa fokus kana akademikna nganggo sajatro.,Santosa kasuburan kagiatan padi,Santosa kudu bisa nyaimbangkeun akademik,Santosa kasungut sikap ka mahasiswa,Santosa ngadep dina kampus
Agriculture,Santosa nyaimbangkeun akademik sareng kagiatan padi.,Surya ngajani kapanggihan tanaman sajatro.,Surya ngajani tanaman singkong,Surya kasungut kapanggihan tanaman,Surya kawula,Surya teu gaé nyambungan ka kawula
Agriculture,Sari keur mendapat uang yang layak.,Budi teu bisa panen jagung.,Budi mau ngurusi sawah,Budi bikin parcel sawah,Budi mangol ka tukang jual benih,Budi tanam benih di sawahnya
Agriculture,Budi sukses panen jagung.,Salsa hilang kopi-nya.,Salsa mau ngopi sambil melihat padi,Salsa jualan kopi ka warung,Salsa jualan kopi ka saudara,Salsa ngopi di samping sawah
Agriculture,Salsa menikmati kopi-nya.,Dedi hanya mendapat uang dari jahat.,Dedi mau belajar tentang pertanian,Dedi baca buku tentang tanaman,Dedi cari tauke yang mahir,Dedi jadi tauke yang baik
Agriculture,Dedi mendapat uang yang layak.,Tini gagal jual kangkung.,Tini mau jadi petani kangkung,Tini belajar tentang kangkung,Tini tanam kangkung di sawahnya,Tini jual kangkung ke pasar
Fisheries and Trade,Epa ngajari anakna cara ngendak ikan,Epa marah nu mboten ngajari,Epa teu ngajari anakna cara ngendak ikan,Anakna manggaŋ ikan matak duith,Epa hoyong ikan nu hunggeut,Anakna ngasih alasan nu hunggeut ikan
Fisheries and Trade,Ibu Dina ngerti bahasa pasaré,Pasaré ngajak Ibu Dina ngomong bahasa Inggris,Ibu Dina nganggo pasar,Ibu Dina ngali-nali ikan matak,Ibu Dina ngomong bahasa Sunda nu mamakai ikan,Pasaré teu bisa ngerti
Fisheries and Trade,Ayahna ngasih ikan kepada keluarganya,Ayahna jual ikan ke pasaré,Ayahna sabarangi ikan teu matak,Ayahna manggaŋ ikan nu waktu malam,"Ikan matak, suwung suwung",Ayahna ngomong cara nyembak ikan
Fisheries and Trade,Endah mendapat harga yang baik,Endah hina mitra kuliner,Endah manggaŋ ikan ka mitra kuliner,Mitra kuliner teu mau beli ikan,Endah ngasih harga murah,Mitra kuliner teu mau beli
Fisheries and Trade,Kang Dio mengikuti pengajian,Kang Dio hilang hingga sore hari,Kang Dio ngajak teman-temannya ngendak ikan,Teman-teman bakal ngasih ikan kepada Kang Dio,Kang Dio mau jual ikan,Eyangna Kang Dio mau ngajak ke pengajian
Art,Euis bakal jadi salah satu pesona upacara angklung saung angina.,Euis teu bisa nyaeta upacara angklung saung angina.,Euis nyaeta upacara angklung saung angina,Euis kajepan upacara anu,Euis ngomong-ngomong sareng teman-temannya saé,Euis jalmi salusan angklungna
Art,Salsabila bakal jadi saudara baru saung kawinan.,Salsabila teu bisa ngajaji kawinan saudara.,Salsabila ngajaji kawinan saudara,Salsabila kajepan ngajaji anu,Salsabila ngajani saung bendoan,Salsabila ngomong-ngomong sareng nenekna
Art,Tono bakal mengenal makna-makna sastrawi kuno Sunda.,Tono teu bisa mengerti sastrawi kuno.,Tono ngajek-ajekan sastrawi kuno,Tono kajepan sastrawi anu,Tono ngajekkeun sastrawi aya berasal dari Sunda,Tono ngomong-ngomong sareng guru wiwitan
Art,Putri bakal mendapat penghargaan saat upacara pencak silat.,Putri teu bisa mengenal pencak silat.,Putri nyaeta upacara pencak silat,Putri kajepan upacara anu,Putri ngajar pencak silat saé,Putri ngomong-ngomong sareng suami
Art,Sari bakal jadi artis kebaian Sunda.,Sari teu bisa ngajar kebaian saé.,Sari ngulis kebaian kebo,Sari kajepan kebaian anu,Sari ngajar kebaian saé,Sari ngomong-ngomong sareng saudara
Art,Eka nyetel gangsa ku hati Sunda.,Sari teu nakam ka kecapi ku hutan.,Sari nandurin ka upacara wedangan,Malihan sari nakam ka kecapi,"Ka upacara dénten, sari teu nakam ka kecapi","Aya banyak ora nakam, sari teu nakam kawula ku sajena"
Art,Sari nakam ka kecapi ku hati.,Sri ngilangi rebab ku hutan.,Sri mangajati ka wayang golek,Sri nakam ka rebab,"Ka buah dénten, Sri ngajar ka wayang teu berisik","Dindingna kali-kali dénten, Sri teu jadi anggeunya"
Art,Sri nyetel rebab ku hati Sunda.,Budi ngilangi kendang ku hutan.,Budi mangajati ka gamelan,Budi nakam ka kendang,"Ka langit dénten, Budi ngajar ka gamelan teu berisik","Alasna kali-kali dénten, Budi teu jadi anggeunya"
Art,Budi nyetel kendang ku hati Sunda.,Dian ngilangi saron ku hutan.,Dian mangajati ka tari pencak silat,Dian nakam ka saron,"Ka langit dénten, Dian ngajar ka tari teu berisik","Dindingna kali-kali dénten, Dian teu jadi anggeunya"
Art,Ema mengembalikan uang ke dana upacara.,Dika meninggalkan belajar gamelan.,Dika belajar memainkan gamelan Sunda,Dika sering boros waktu saat belajar,Bapak Dika tidak senang dengan eksesinya,Dika merasa tidak bisa mengambil tindakan yang tepat
Art,Dika memulihkan konsentrasinya dan terus belajar dengan bijaksana.,Sari meninggalkan mimpi menjadi penari tradisional.,Sari ingin menjadi seorang penari tradisional Sunda,Sari tidak mau melatih diri dengan baik,Wali Sari tidak setuju dengan keputusannya,Sari merasa kecewa dengan dirinya
Art,Sari mengambil tindakan untuk terus belajar dan meningkatkan kemampuan.,Santi meninggalkan mimpi menjadi puisi Sunda.,Santi ingin menulis puisi Sunda yang bagus,Santi sering menimbulkan kekacauan saat menulis,Orangtuanya tidak senang dengan perilaku Santi,Santi merasa tidak yakin dengan dirinya
Art,Santi memperbaiki perilaku dan terus menulis puisi dengan hati-hati.,Adi meninggalkan seni tradisional.,Adi menghabiskan banyak waktu untuk membuat seni tradisional,Adi tidak mau mengambil tanggungjawab lain,Orangtua Adi tidak setuju dengan eksesinya,Adi merasa tidak bisa mengambil tindakan yang tepat
Traditional Games,Démbakan teu bisa ngelawéh waduk gunung saka anggonéhna waduk,Démbakan énggorok sareng waduk gunung iki.,Sela-selaan démbakan garengan tajenan,Sinetron Sunda énggorok komunitas démbakan,Rakithaan énggorok sareng kawula-kawula démbakan,"Kapaksa démbakan ngahubungi waduk gunung, karepakeun kagetan démbakan"
Traditional Games,Balap karungan teu bisa ngadapé waduk karepakeun kecurutan karungan,Balap karungan énggalakeun sareng waduk.,Ara-ara bajèngeun balap karung,Karungan énggalakeun di tengah desa,Déthèk-déthèk énggalakeun kawula-kawula balap karungan,"Kapaksa balap karungan ngahubungi waduk, karepakeun kecurutan karungan"
Traditional Games,Congklak teu bisa ngajari ngomong-ngomong saka anggonéhna congklak,Congklak énggalakeun sareng warung kopi.,Sekola teh kudu ngajari congklak,Congklak énggalakeun di musrenbang sareng kawula-kawula,Badan keagamaan énggorok sareng congklak,"Kapaksa congklak ngahubungi warung kopi, karepakeun ngomong-ngomong congklak"
Traditional Games,Enggal teu bisa démbakan saka anggonéhna enggal,Enggal énggalakeun sareng hutan.,Sanggar énggalakeun garengan enggal,Enggalan énggorok sareng déthèk-déthèk,Pasangan énggalakeun sareng démbakan,"Kapaksa enggal ngahubungi hutan, karepakeun démbakan enggal"
Traditional Games,Tina pepadhetan.,Dedi wani asup ka alun-alun.,Dedi mangajeg rancak alun-alun,Dedi mangajeg bakal nyeri muka,Dedi mangajeg mun aya nu ganggangan,Dedi nanging ngajeg kasampeun murid-murid
Traditional Games,Dedi nanging mangajeg kasampeun guru.,Mbah Darmo wani asup ka imah.,Mbah Darmo mangajeg congklak di halaman imah,Mbah Darmo ngajeg kasampeun tuduhan,"Mbah Darmo kalah, sakit paru-paru",Mbah Darmo ngajeg mun aya nu cacah congklak
Traditional Games,Mbah Darmo ngajeg mun aya nu dumai congklak.,Adi wani asup ka jalanan.,Adi mangajeg kelereng di jalanan,"Adi nakilep kelereng, wae ku bumit",Adi nakilep mun aya nu kawungan,Adi nanging ngajeg kasampeun teman-temannya
Daily Activities,Euis jadi ahli perbekalan anjing,Dian henteu ilubiung dina limo sapi ayeuna,Dian nyaeta ka limo sapi ka pasar,Dian teu nyangka bakal manggawe sapi-sapihan ieu,Dian ngan miharep yén Allah bakal masihan anjeunna hadiah,Dian pasrah kana kersa Gusti
Daily Activities,Dian jadi pedagang sapi,Tati henteu ilubiung dina tukang kopi ayeuna,Tati nyaeta ka tukang kopi ka kedai,Tati teu nyangka bakal manggawe kopi-kopian ieu,Tati ngan miharep yén Allah bakal masihan anjeunna hadiah,Tati pasrah kana kersa Gusti
Daily Activities,Tati jadi pengusaha kedai kopi,Santi henteu ilubiung dina limo buah ayeuna,Santi nyaeta ka limo buah ka pasar,Santi teu nyangka bakal manggawe buah-buahan ieu,Santi ngan miharep yén Allah bakal masihan anjeunna hadiah,Santi pasrah kana kersa Gusti
Daily Activities,"Eka teu ngajajan, melayani koplakan pesenan.",Santi ngucapé kalimat panjang salah.,Santi ngajari ka bahasa Inggris,Santi ngucapé salam ka teman-temannya sambil ngomong Inggris,Santi ngucapé-ucapé huruf-huruf,Santi ngucapé kalimat pendek
Daily Activities,Santi ngucapé kalimat pendek dengan benar.,Asep nganggo jalanan kota.,Asep nganggo pikulan ka pasar,Asep nganggo sepatu kancéng,Asep ngambil pikulan ka tangan,Asep nganggo jalanan kampung
Daily Activities,Asep nganggo jalanan kampung dengan leluasa.,Dewi ngajak teman-temannya ngidupkeun makanan sakola.,Dewi ngidupkeun makanan sakola,Dewi ngajari ka memasak,Dewi ngajak teman-temannya bantu,Dewi ngajak teman-temannya makan
Daily Activities,Dewi ngajak teman-temannya makan dengan senyum.,Budi ngajak teman-temannya nonton film di rumah.,Budi ngajak teman-temannya ke bioskop,Budi ngajak teman-temannya ke siniema,Budi ngajak teman-temannya nonton film,Budi ngajak teman-temannya beli popcorn
Daily Activities,Budi ngajak teman-temannya nonton film sambil makan popcorn.,Sari ngajak adik-adiknya jual kue.,Sari ngajari ka membuat kue,Sari ngajak adik-adiknya bantu,Sari ngajak adik-adiknya makan kue,Sari ngajak adik-adiknya beli alat-alat membuat kue
Daily Activities,Sari memutuskan untuk lebih banyak menyenangi waktu bersama Putri Ayu.,Budi meninggalkan Ani di jalan dan melanjutkan perjalanannya.,Budi mengendarai sepeda motor ke pasar pagi hari,Ia menjual buah-buahan segar untuk mendapatkan uang,"Saat di jalan, Budi menemui seorang anak yang hilang, Ani",Budi mengajak Ani ke pasar dengan sepeda motor
Daily Activities,Budi mengantarkan Ani ke rumahnya setelah membeli buah-buahan.,Santi menipu Siti dengan menjual sayuran kurang segar.,Santi mengembangkan kebun sayur di belakang rumah,Ia merawat tanaman segar setiap hari,Santi menjual hasil panen ke tetangga untuk mendapatkan uang,"Seorang hamil, Siti, membutuhkan sayuran segar untuk kesehatan"
Daily Activities,Santi memberikan sayuran terbaik kepada Siti.,Dini meninggalkan Eka saat terbakar.,Eka dan Dini bermain bersama di taman bermain sore hari,Ia bermain di kawah api dan bermain gitar,"Saat bermain, Eka terbakar dan luka",Dini merasa bersalah karena tidak memperhatikan Eka
Daily Activities,Dini membantu Eka membasmi api dan merawat luka.,Bapak Ali melarikan diri setelah kecelakaan.,Bapak Ali mengemudikan mobil ke kantor,Ia bekerja sebagai pengawas di perusahaan,"Saat di jalan, Bapak Ali mengemudikan cepat dan tidak memperhatikan lampu merah",Ia menyebabkan kecelakaan
Socio-religious aspect of life,Budi jeung saudara sok nyawaréun kasemban ulang.,Sari geus duweun sajrono.,Sari langkah ka kramat ayeuna sak siro,Sari kudu ngajajah di sisi saé,Tangisan sareng pujian kasemban sari,"Tapi nalika sari geus ngajajah lagi, manggih aya ing jalma"
Socio-religious aspect of life,Raka sok ngajajah kasebutan sareng bakti sareng keluarga.,Dewi geus nedah ka jalma.,Dewi nangingin ka paringsunan,Dewi kudu ngajajah kasemban tunggal,"Waktu keur paringsunan, Dewi minangkeun bakti sareng istri wadon","Tapi waktu maraneh, Dewi teu tiasa nedah saka pangarep"
Food,Rian ngasorakeun iresan na pisan,Ridwan déh kuwéh kain Sunda sareng ornamen,Ridwan réspo déh ngajat kain Sunda,"Mésálahna kain Sunda énggal, ribet wis kuwéh",Ridwan ngomong-ngomong ka pangajen sareng kaum Sunda,Ridwan teu nyangka kain Sunda iku pakek saka hajat adat
Food,Ridwan ngajari kain Sunda wong saké²,Sella déh ngajat bakul bajigur karo ibunya,Sella téh bakul bajigur ka pasar,"Sareng bajigur, Sella déh ngajat kue kacang hijau","Sella ngomong-ngomong ka teman-temannya, kue kacang hijau iku déh makanan panganéan","Sareng kaum Sunda, kue kacang hijau iku makanan panganéan saké²"
Food,Sella déh nyimpen bajigur ka rumahaké²,Andi déh ngajat nasi tim ka kamar keneh,Andi téh ceuri sekoteng ka warung,"Séka sekoteng éta, Andi déh ngajat nasi tim","Andi ngomong-ngomong ka teman-temannya, nasi tim iku déh makanan panganéan ka warung","Sareng kaum Sunda, nasi tim iku makanan panganéan ka warung"
Food,Andi déh nyimpen nasi tim ka rumahaké²,Ayu déh ngajat es doger sareng selasih ka dunia,Ayu téh ngajat laklak ka pangajen,"Laklak éta, Ayu déh ngajat es doger sareng selasih","Ayu ngomong-ngomong ka teman-temannya, es doger sareng selasih iku déh minuman panganéan","Sareng kaum Sunda, es doger sareng selasih iku minuman panganéan saké²"
Food,Euis nyeneng ka ngajual sajian nasi timbel ka pasar,Tiyang Endah ngasi buah salak nu anak-anak,Tiyang Endah suwiran buah salak nu kecukupan,Tiyang Endah émbuhlah ngajual buah salak nu kecukupan sareng keluarga,Tiyang Endah kirim buah salak kepada saudara-saudaranya yang tinggal di kota,Tiyang Endah nikmati buah salak sambil ngobrol sareng teman-temannya
Food,Tiyang Endah nikmati rasa buah salak dina kecukupan,Santosa ngasi minuman tradisional nu anak-anak,Santosa keluarga émbuhlah ngajual minuman tradisional nu kafe,Santosa émbuhlah ngajual minuman tradisional nu kafe sareng teman-temannya,Minuman tradisional nu kafe Santosa ngacung diwong sareng rempah-rempah alami,Santosa ngasi minuman tradisional nu kafe sareng keluarga saudara-saudara
Food,Santosa émbuhlah ngajual minuman tradisional nu kafe sareng teman-temannya,Eka ngasi kerupuk nu anak-anak,Eka keluarga émbuhlah ngajual kerupuk ka pasar,Eka émbuhlah ngajual kerupuk ka pasar sareng teman-temannya,Kerupuk Eka ngacung diwong sareng bumbu rempah-rempah alami,Eka nyeneng ka ngajual kerupuk ka pasar sambil ngobrol sareng teman-temannya
Food,Eka émbuhlah ngajual kerupuk ka pasar sareng teman-temannya,Sari ngasi kue nu anak-anak,Sari keluarga émbuhlah ngajual kue tradisional nu pasar,Sari émbuhlah ngajual kue tradisional nu pasar sareng teman-temannya,Kue tradisional Sari ngacung diwong sareng bahan-bahan alami,Sari nyeneng ka ngajual kue tradisional nu pasar sambil ngobrol sareng teman-temannya
Wedding,"Namun, upacara berjalan lancar dan semua hadirin puji dan syukur.","Namun, banyak tamu tidak hadir dan acara din cancel.",Eka dan Dina menyiapkan acara pernikahan mereka,"Dia memilih tempat pernikahan di kampung halaman, dekat dengan sungai Alas","Dia juga memesan berbagai jenis masakan tradisional Sunda, seperti lalap, urap, sate, dan nasi timbel","Untuk hiasan, mereka memilih warna-warna hijau, kuning, dan ungu yang menyerupai warna alam"
Wedding,"Namun, acara sukses dan semua tamu menikmati hidangan dan keindahan tempat.","Namun, banyak undangan hilang dan tamu tidak tahu acara.",Agung dan Siska mengundang para tamu untuk pernikahannya,"Mereka menyediakan undangan yang elegan, dipanggil ""Surat Candra""","Di dalamnya, mereka mengucapkan terima kasih dan mengundang tamu untuk hadir pada upacara pernikahan mereka","Selain itu, mereka juga mengirimkan berbagai jenis undangan tradisional, seperti ""Surat Serangan"", yang dikirim ke orang-orang dekat mereka"
Wedding,"Namun, seluruh undangan sampai tujuan dan semua tamu hadir pada acara.","Namun, hadiah rusak dan orang tuanya marah.",Adi dan Dwi mengadakan upacara adat Sunda sebelum pernikahan,"Mereka melakukan ""Siraman Air Mata"", yang merupakan upacara membersihkan muka dan jari-jari tangan calon suami dan calon istri","Setelah itu, mereka melakukan ""Majalengka"", upacara mengajak calon suami dan calon istri untuk bersama-sama memegang benda-benda tradisional Sunda","Di akhir upacara, mereka menyampaikan hadiah kepada orang tuanya dan tamu"
Wedding,Sari siap-siap nikah dengan Raka.,Dede teu bak nganti ke bak mandi.,"Dede mau nganti ke bak mandi, iu rantau ka kampung ielangan",Dede ngetok bak mandi kebo,Dede mengusir kura-kura iki,Dede mengenakan bajunya ka wedingan
Wedding,Dede siap nganti ke bak mandi.,Anto teu bak mengirim jenang mamae.,Anto mau ngajari jenang mamae,Anto mencari bahan-bahan di pasar,Anto memasak jenang mamae,Anto mengirim jenang mamae ke rumah tua
Wedding,Anto mengirim jenang mamae ke rumah tua.,Euis teu bak mengenakan kebaya ielangan.,Euis mau nanduri kebaya ielangan,Euis mencari benang warna-warni,Euis membuat kebaya ielangan,Euis mengenakan kebaya ielangan iu wedingan
Wedding,Euis siap mengenakan kebaya ielangan.,Wawan teu bak mengenakan bajunya wes iki.,Wawan mau nganti ka bajunya wes,Wawan mencari baju wes iki,Wawan memutihkan kulitannya,Wawan mengenakan bajunya wes iki
Wedding,Salsabila nikahi Raka sakapan sareng kulawargana,Euis mboten buka warung serabi,Euis teu panggap nikmat banget serabi Sunda,Euis nganti mau buka warung serabi,Euis teu butuh dhukungan keluarganya,Euis nangis kana Gusti
Wedding,"Euis buka warung serabi, sukses menjadi favorit masyarakat","Budi nikahi wanita itu, diparuh denda oleh keluarga kampung",Budi teu tau peraturan bakal nikah di kampung,Budi teu mau nikah dengan wanita dari kota,Budi teu nanya keluarga wanita itu,Budi pasrah kana Gusti
Wedding,"Budi mengambil wanita dari kampung, menjadi suami baik dan hormat",Iis tidak mampu menikahi Fandy,Iis teu mau ngetem dengan Fandy,Iis teu mau usahakan pernikahan mereka,Iis teu nanya bantuan dari ibunya,Iis nangis kana Gusti
Wedding,"Iis dan Fandy menikah, berkreasi hidangan tradisional Sunda di pesta nikah",Dhani tidak mampu memulai usaha jualan selai kacang,Dhani teu tau cara menyiapkan selai kacang Sunda,Dhani teu mau buka usaha jualan selai kacang,Dhani teu butuh investasi,Dhani nangis kana Gusti
Family Relationships,Prabu teu mamah di sareng maman,Ajis dipidingi kagum,"Ajis kasurupan dadai, dipidingi kagum",Ajis teu nyangka kawula kagum dipidingina,"Ajis mohon ka kawula, ""Ndeus kawula, nangingin dipidingi kagum?""","Kawula jawab, ""Dipidingi karepakeun sareng ibu kawula"
Family Relationships,Ajis teu nangingin dipidingi kagum,Santosa dipilih kanggo ngadeg bakulan,Santosa nyaungi kawula kanggo ngadeg bakulan,Santosa teu nyangka kawula kagum ngadegina,Santosa nyalas maringi saka kawula,Santosa pasrah kana kersa Gusti
Family Relationships,Santosa teu nangingin dipidingi kagum,Susanto dipilih kanggo ngadeg kupat tahu,Susanto nyaungi kawula kanggo ngadeg kupat tahu,Susanto teu nyangka kawula kagum ngadegina,Susanto nyalas maringi saka kawula,Susanto pasrah kana kersa Gusti
Family Relationships,Budi ngajak Sari nimukeun ka guru algebra.,Wira ngajari saré ka Bagus.,"Bagus kagum ka bocah anu nu kapanggilan ""Wira""",Wira nu kenekakeun saré sareng ngoding ka kudu,Wira teu ngajari saré,Bagus ngajak Wira ka kulonan
