topic,correct_ending,incorrect_ending,sentence_1,sentence_2,sentence_3,sentence_4
Food,Sariangna dibohongi temen.,Dedé maké kakekna sakola.,Dedé jeung kakekna ngerasa nganggo nasi timbel jeung sambal dabu-dabu ka sakola,"Dedé mangga, kakekna teu kuasa",Kakekna maké nasi timbel jeung sambal dabu-dabu,Dedé dikebon ka sakola
Food,Budi kaheunanggeun wadon nu tiasa mamah.,Sri nganti nasi timbel nu tiasa ku bakul.,Sri nangingin nasi timbel ka pasar,"Sri kaheunanggeun, ""Nasi timbel nu suwungan, ku sageranakeun bakul",""" Sri kaheunanggeun bakul nasi timbel ku pasar","Di pasar, Sri kaheunanggeun nasi timbel nu tiasa ku bakul"
Food,"Sri nganti nasi timbel nu tiasa ku bakul, tapi nasi timbel nu suwungan.",Santosa kaheunanggeun kopi belas ka gado-gado kabeh.,Santosa kaheunanggeun bianggu kopi nu belas,Santosa kaheunanggeun gado-gado ka warung,"Di warung, Santosa kaheunanggeun kopi belas ku gado-gado",Santosa kaheunanggeun kopi belas ka gado-gado ku salapi
Food,Santosa kaheunanggeun kopi belas nu suwungan ka gado-gado.,"Yani kaheunanggeun pisang ijo nu tiasa ka salapi, tapi kaheunanggeun kepiting nu tiasa.",Yani kaheunanggeun manggul ka kedai pisang ijo,Yani kaheunanggeun pisang ijo ka salapi,"Di kedai, Yani kaheunanggeun pisang ijo nu tiasa ka salapi",Yani kaheunanggeun pisang ijo ka ganti kepiting
Food,Eka manggareskeun sate ka kaumna.,Eka rék nganjang ka kasusian sate.,Eka duduka ka rumahna kana kenèng kadéngé,Eka ngajual sate keur keluarga,Eka manggareskeun porsi sate ka sakola malingan,Eka teu nunggaan kasusian sate yang tersisa
Food,Dewi ngulik duit kucuran.,Dewi ngulik duit ka kafé.,Dewi ngajual jajanan Sunda ka pasar,Aya banyak pembeli,Dewi teu dapat kucuran duit,Dewi teu bisa bérkeun ka kafé
Food,Raka ngajek ka teman-temannya nu sakopi.,Raka nunggaan porsi kopi.,Raka duduka ka rumahna kana kangen kopi Sunda,Raka ngajual kopi ka kedai kopi,Raka kasarakeun porsi kopi ka teman-temannya,Raka teu bisa ngajek ka tempat bermain
Food,Sari ngambil pesenan nu ngirim ke pemesan.,Sari ningali pesenan.,Sari teu bisa nanggoteun pepesanan,Sari diterima beberapa pemesanan,Sari nandika ka dapur ngolah-ngolah,Sari teu tiasa ngambil pesenan
Food,Adi ngandika ke rumah nu bikin laklak lagi.,Adi ngulik duit ka rumah.,Adi ngajual laklak ka pesta,Aya banyak tamu,Adi teu tiasa ngambil duit,Adi teu bisa ngandika ke rumah
Food,Santi kasih pesenan nu ngirim ke pelanggan.,Santi nunggaan pesenan.,Santi ngajual pisang goreng ka warung,Aya banyak pelanggan,Santi teu bisa ngebet ka kantin,Santi teu tiasa kasih pesenan
Food,Agung ngambil kue nu ngirim ke konsumen.,Agung ngulik kue ka taman.,Agung duduka ka rumahna kana kenèng kue Sunda,Agung ngajual kue ka kedai,Agung teu bisa bérkeun ka taman,Agung teu tiasa ngambil kue
Food,Ayu ngambil pesanan nu ngirim ke pesanan.,Ayu ningali pesanan.,Ayu ngajual kerupuk ka warung,Aya banyak pesanan,Ayu nanggoteun ka dapur,Ayu teu tiasa ngambil pesanan
Food,Bima ngambil es campur nu ngirim ke konsumen.,Bima nunggaan es campur.,Bima duduka ka rumahna kana kenèng es campur,Bima ngajual es campur ka warung,Bima teu bisa ngajek ke tempat berenang,Bima teu tiasa ngambil es campur
Food,Andi ngandika ke rumah nu bikin bakpia lagi.,Andi ngulik duit ka rumah.,Andi ngajual bakpia ka kedai,Aya banyak pembeli,Andi teu tiasa ngambil duit,Andi teu bisa ngandika ke rumah
Wedding,Undangan pernikahan dikirim kepada para tamu,Santri mengkhianati agama Islam,Santri Sunda bakal dijodoh,Pasangan udah lama ngadaging sareng saudaranya,Gadis Sunda geus ngadeg-ngadegkeun kebaya sidoso,Pasangannya geus ngadeg-ngadegkeun baju kurta
Wedding,Santri mengucapkan doa selamat,Makanan pernikahan dihapus,Niniak Sunda ngandong,Niniak geus ngadeg-ngadegkeun baju kebaya,Pasangannya geus ngadeg-ngadegkeun baju batik,Tamu-tamu ngucapakeun selamat
Wedding,Makanan pernikahan disajikan kepada tamu-tamu,Taruhan dibuka,Para tamu ngulur ka rumah pernikahan,Tamu-tamu geus nyalakakeun lampu,"Mangajat kepada para tamu, ngajakakeun ke meja makan",Para tamu geus nakapeun kopi
Wedding,Taruhan ditutup,Hadiah dijual,Istri Sunda ngandongi panganteman,Istri geus ngadeg-ngadegkeun baju kebaya,Suami geus ngadeg-ngadegkeun baju batik,Para tamu ngucapakeun selamat
Wedding,"Ari ngajasi kawinna, sari teu ngadukung kawinna","Ayu teu ngadukung dadali, Raka teu bisa didadari","Ayu hadir pepaksonan, sarua wiwitna urip","Raka hadir pepaksonan, sarua wiwitna urip","Dihajurna wedhana kawin, sarua wiwitna urip","Ayu teu bisa didadari, Raka teu ngadukung dadali"
Wedding,"Ayu dadali Raka, Raka teu ngadukung dadali","Giring dijajalna Siti, Siti teu bisa dijajalna","Siti tiasa wedhus, sarua wiwitna urip","Giring tiasa wedhus, sarua wiwitna urip","Gadhipun wiwitna, sarua wiwitna urip","Giring teu bisa dijajalna, Siti teu ngadukung dadali"
Wedding,"Siti dijajalna Giring, Siti teu ngadukung dadali","Dani kawin Santi, sarua pepetna hajat kadjieun","Dani geus tiasa dipadukana, sarua pepetna hajat kadjieun","Santi geus tiasa dipadukana, sarua pepetna hajat kadjieun","Geus pepetna wiwitna, sarua pepetna hajat kadjieun","Dani teu sajrono kawinna, Santi teu ngadukung kawinna"
Wedding,"Éka ngasih sumpingan balik, Éta ngajalakan Éka manggaurana.","Émi ngasih Éko kembang kenikir, Éko teu ngagaduak.",Gadis Émi giwakéun serangga ka imah Éko,"Émi teu ngagaduak, saiki Éko ngasih Émi kembang kenikir","Émi ngagandong kembang, saiki Éko ninggah Émi ka langit","Émi sok ngajalakan Éko, Éko teu ngasih jawab"
Wedding,"Émi ngajalakan Éko, Éko ngasih Émi kembang kenikir kapanganten.","Éta ngirim Émi bunga pepotong lagi, Émi teu ngasih balasan.",Ning Bambang ngajalakan Éta ngalaksa Émi,"Éta teu ngasih jawab, Émi ngasih Éta bunga pepotong","Éta ngajalakan Émi, saiki Émi ngajalakan Éta manggaurana","Éta teu ngasih balasan, Émi ngirim Éta bunga pepotong lagi"
Wedding,"Éta ngasih Émi manggaurana, Émi ngasih balasan kapanganten.","Éta ngirim Surati bunga lagi, Surati teu ngasih sumpingan.",Ning Surati ngagaduri Éta manggaurana,"Éta teu ngasih jawab, saiki Surati ngajalakan Éta manggaurana kapanganten","Éta manggaurakeun Surati, Éta ngasih Surati bunga pepotong","Éta teu ngasih sumpingan, Surati ngirim Éta bunga lagi"
Wedding,"Surati ngajalakan Éta, Éta ngasih Surati sumpingan kapanganten.","Éci ngasih banteng kembang kenikir, banteng teu ngagaduak.",Anak Éci giwakéun banteng ka imah,"Éci teu ngagaduak, saiki banteng ngasih Éci kembang kenikir","Éci ngagandong kembang, saiki banteng ninggah Éci ka langit","Éci sok ngajalakan banteng, banteng teu ngasih jawab"
Family Relationships,Eyang maksa Sari asup kana adat Sunda,Sari ngan hiji anggota adat Sunda,Sari adalah putri yang suka ngajari sastra,Eyang Sari suka ngajari adat Sunda,Sari jeung Eyang dina widang béda,Sari teu tiasa gabung Eyang
Family Relationships,Prabu tiasa ngurusi masalah keluarga sareng pribadinya saé,Prabu ukur hayang fokus kana kariranya,Prabu adalah kepala keluarga yang besar,Prabu kudu bisa ngurusi masalah keluarga,Prabu gaduh manajemen waktos anu saé,Prabu tiasa ngaréngsékeun sadaya pancén kalayan saé
Family Relationships,Dewi gura-giru hayang menjadi seorang ibu yang baik,Dewi rék kawin lagi,Dewi naék kawin kapala wadon,Dewi kakara anak dua,Dewi ngabéjaan yén Ibu,"Ibu ngabéjaan yén Nenek, misanna Dewi aya di rumahnya"
Family Relationships,Santosa tiasa ngabagi waktosna antara padamelan sareng diajar,Santosa teu bina usaha,Santosa adalah sivitas muda yang suka ngajari ilmu komputer,Santosa ngalungkeun ilmu komputer ka perguruan tinggi,Santosa digawé ti loker nepi ka perusahaan teknologi,Santosa indit ka bina usaha soré
Family Relationships,Agung henteu hilap mésér takjil di dinya salami bulan Ramadhan.,Agung henteu hilap ngalaksanakeun solat tarawih di masjid salami bulan Ramadhan.,Agung sering meuli takjil di masjid deukeut imahna,Aya rupa-rupa takjil anu dijual,"Aya kolek cau, rupa-rupa gorengan, jeung sababaraha rupa inuman es",Karesep Agung nyaéta bakpia sareng kue cubit
Family Relationships,Ucup ngamus diparentosna kumaha madrasah.,Nyi Siti ngomong jaman kabeh sampeyan kaget.,Nyi Siti kacak ngomong dengan tante si Mbak Santi,Mbak Santi ngajualan jamu tradisional,Nyi Siti ngajualan jamu modern,Nyi Siti ngomong sampeyan kaburan jaman
Family Relationships,Nyi Siti mau ngiyak jamu tradisional Mbak Santi.,Kula ngiring kawula sakola kanggo ngadep budaya Sunda.,Ngabéhna kula ngantiak sakola sareng kaumna,Kaumna teu nanggap sakola kanggo nyembakan budaya Sunda,Sakola teu nanggap budaya Sunda,Mereka nu gémbongan kawula sakola
Family Relationships,Euis ngadeg-ngadeg Dede karep sae.,Ayu ngamet-ngamet pangestu.,Ayu becik ka pasar,Ayu ngajual buah-buahan nanggung,Ayu ngajualan buah-buahan ka pangestu,"Pangestu sampeyan ngadep ka Ayu, ""Ayu, saebya raja-raja buah-buahan ku"
Family Relationships,Ayu ngomong-ngomong pangestu sareng ngasorakakeun pasal buah-buahan.,Masihan nyimpen porsi tambahan bakso sareng makan sendiri.,Santoso ngarap ka keur kampungna,Santoso ngomong-ngomong sareng masihan,Santoso ngajak-ngajak sareng masihan ngumpul keur kantin,"Masihan nyimpen porsi tambahan ka sate, bakso, sambal"
Family Relationships,"Masihan berbagi porsi tambahan ka sate, bakso, sambal.",Sami nari sendiri.,Sami nangis ka kamarana,"Sami ngasungkeun ibunya, ""Ibu, saela-saela saur kami",""" Ibunya ngomong-ngomong sareng nyusyamakeun Sami",Ibunya ngajak Sami nari ka keur saur
Family Relationships,Sami ngadeg-ngadeg sareng ibunya nari ka keur saur.,Putri nganti pangestu.,Putri ngajak ka jalan-jalan ka keur kota,Putri ngajualan bakpia ka pangestu,Pangestu nyimpen bakpia ka Putri,Pangestu ngajak Putri ka rumahnya
Pregnancy and Kids,Eka nakacaéntana jenazah sahabatna dina tanggalan urip sahabatna.,Sari teu ngajak pasangan sareng anak-anaknya kumanten kabar meninggal ibunya.,Sari dikeun jenazah ibunya,Sari teu nyambut pasangan sareng anak-anaknya,Sari manggik keur kamar ibunya,Sari nakacaéntana kamar ibunya
Pregnancy and Kids,Sari nakacaéntana kamar ibunya dina waktu sareng pasangan sareng anak-anaknya.,Agung teu ngajak tetekna kumanten kabar bersalin.,Agung ngajak tetekna sareng suwarganya ke bersalin,Agung teu manggik keur kamar tetekna,Agung nyusul teu sareng suwarganya,Agung ngadur kamar tetekna dina waktu bersalin
Pregnancy and Kids,Agung ngadur kamar tetekna dina waktu bersalin sareng suwarganya.,Santi teu ngajak pasangan sareng anak-anaknya kumanten kabar meninggal ibunya.,Santi teu nakacaéntana ibunya,Santi teu nyambut pasangan sareng anak-anaknya,Santi nakacaéntana kamar ibunya,Santi ceurik teu daékeun
Pregnancy and Kids,Santi nakacaéntana kamar ibunya dina waktu sareng pasangan sareng anak-anaknya.,Dini teu ngajak anaknya kumanten kabar meninggal anaknya.,Dini teu nakacaéntana anaknya,Dini nakacari kamar anaknya,Dini ceuken teu dina bakula,Dini manggik keur kamar anaknya
Pregnancy and Kids,"Ema ngajajah kapanggih, kanggo mendapat bantuan perawatan anak.","Bibin ngajajah kakawasaan, malah mamáh kasihan anakna.",Bibin ka Mangku kawula kajenén kacang panjang,"Bibin teu séresé, cuma kasihan anakna","Eyangna teu pisan mboten nandurakeun, karepak ya kudu manggungkeun kagiatan mamáh","Anakna kadua mamáh, kasihan sareng kajenéna"
Pregnancy and Kids,"Bibin ngajajah kakawasaan, kanggo ngurusi kajenéna anakna.","Ajah ngajajah sampeyan, langsung ngajajah kapanggih.",Ajah ka Usang punika kanggo mangajéji,Ajah kudu bisa nyambangkeun sareng anak,"Ajah kanggo ngajéji, nyuwun pangajéjannya sareng anak","Ajah kasihan anak, tiasa ngajajah sareng anak"
Pregnancy and Kids,"Ajah ngajajah sampeyan, kanggo ngurusi anak kudu nyambangkeun.","Ajahna Éka ngajajah kapanggih, malah ngajajah sampeyan.","Ajahna Éka kasihan anakna, tiasa manggungkeun kagiatan mamáh",Ajahna Éka kudu nyambangkeun sareng anak,"Anakna sok nandurakeun kapanggih, karepak ya kudu manggungkeun kagiatan ajahna","Ajahna Éka ngadadak karasa teu damang, sering bersin ku wajah"
Pregnancy and Kids,"Ajahna Éka ngajajah kapanggih, kanggo mendapat bantuan perawatan anak.",Élisa kedah ngawangun kamar mandi énggal.,"Éta kamar mandi Élisa ruksak, karepak ya kudu mboten nandurakeun","Éta kamar mandi kanggo ngurusi anak, karepak ya kudu leuwih dadakan","Éta kamar mandi kanggo ngurusi anak, karepak ya kudu panganjalakeun éta","Éta kamar mandi kanggo ngurusi anak, karepak ya kudu ngadadak ku wajah"
Pregnancy and Kids,Saida mimiti hijrah.,Pelayan maké baju anu cocog jeung hiasan warung.,"""Gampang pisan anjeun ngucapkeun cinta","Naon ari cinta?"" cenah bari nyiuk dahareun","""Kanggo kuring, cinta sanés téori anu hartosna kedah dijelaskeun",""" Jawab kuring kalayan sumanget"
Pregnancy and Kids,"""Aneh pisan"".",Kompetisina ieu beuki pikaboseneun.,"Dalam rangka ngarayakeun ulang taun sakola, SMU Mekar ngayakeun kompetisi",Kompetisi nu mimiti nyaéta balap karung antara guru jeung murid,Unggal kelas nyiapkeun wawakil tur ngalawan wawakil guru,Kompetisina sengit
Pregnancy and Kids,Ieu kopmetisi dimeunangkeun ku wawakil siswa.,Adi jeung Dewi geus dua taun teu papanggih.,Adi langkung kolot 3 taun ti Dewi,"Waktu keur budak, maranehna mindeng gelut",Adi mineng ngaheureuyan adina Dewi nepi ka Dewi ceurik,"Tapi nalika aranjeunna dewasa, aranjeunna janten caket"
Pregnancy and Kids,Adi jeung Dewi sok nyempetkeun papanggih sahenteuna saminggu sakali sanajan jadwal sibuk.,Murid kalaparan geus lila teu dahar.,Ada ieu kantin sakola rame pisan,Nu ngajual sate ka ulang taun,Anjeunna masihan porsi tambahan ka 15 murid munggaran anu mésér sate na,"Pas istirahat, murid langsung lalumpatan ka kantin"
Death,Upacara ngomong ngamenan nu maha merenang sarta ngapak saksi,Dian dikebumenan di tanah jawa,Sang ibu Dian mundhing mertua,Dian éta kagum teu wong inggih,Anjeunna kuasa nu panglima,Dian diumumpak kain bercuka nu putih
Death,Upacara ngomong ngamenan nu mahamerenang sarta ngapak saksi,Arya dikebumenan di tanah jawa,Sang bocah Arya mendapet upacara ngucap,Arya éta kagum teu wong ora inggih,Anjeunna kuasa nu panglima,Arya diumumpak kain bercuka nu biru
Death,Upacara ngomong ngamenan nu mahamerenang sarta ngapak saksi,Wati dikebumenan di tanah jawa,Sang tetek Wati meninggal,Wati éta kagum teu wong ora inggih,Anjeunna kuasa nu panglima,Wati diumumpak kain bercuka nu kuning
Death,Upacara ngomong ngamenan nu mahamerenang sarta ngapak saksi,Sari dikebumenan di tanah jawa,Sang adik Sari mundhing,Sari éta kagum teu wong inggih,Anjeunna kuasa nu panglima,Sari diumumpak kain bercuka nu hijau
Death,Sangkakala ngomong-ngomong sareng ibunya na.,Wati nganggo cicipan kancil nu kawin.,"Wati pacul nu kawin, pisan manggungkeun nyembak kancil","Kanggo uripnya, manggungkeun kancil kajenengan pamrih",Wati nganggo cicipan kancil,"Dina waktu nu kawin, kancil déh awak-awaken"
Death,Wati nganggo cicipan kancil sareng pamrihana kawin.,Nyenyakna biawak sareng Euis.,Euis manggungkeun nyembak biawak,"Dina waktu biawak déh awak-awaken, Euis teu nanggapin",Biawak bakakak teu batin,"Dina malam, nyenyakna biawak"
Death,Nyenyakna biawak sareng euyan na.,Nyenyakna kura-kura sareng Sangkakala.,Sangkakala manggungkeun nyembak kura-kura,"Dina waktu kura-kura déh awak-awaken, Sangkakala teu nanggapin",Kura-kura bakakak teu batin,"Dina malam, nyenyakna kura-kura"
Death,Nyenyakna kura-kura sareng euyan na.,Nyenyakna banteng sareng Dewi.,Dewi manggungkeun nyembak banteng,"Dina waktu banteng déh awak-awaken, Dewi teu nanggapin",Banteng bakakak teu batin,"Dina malam, nyenyakna banteng"
Death,Sri nganti nyerembah Allah swt.,Saeunna nganti mamakéun kuburan maranéhna sarta nganti ngandak ka dunya.,"Dina suare jaman, saeunna kuasa mamakéun kuburan",Sapudakna saeunna kagumi,"Nya, saeunna mamakéun kuburan maranéhna",Manggung saeunna ka kuburan
Death,Manggung saeunna ka kuburan sarta nganti nyerembah Allah swt.,Euis nganti ngandak ka dunya sarta nganti ngampeun kuburan sae.,"Euis nya, ""Mbak, nganti ngampeun kuburan sae?"" Mbak ngomong, ""Ada kuasa, Euis",Kalian sajero jangan ngandak,""" Dina awal maranéhna, kagumi dina pepaduan saeunna","Dina akhir, kagumi ka kuburan sae"
Religious Holiday,Anak-anak makan ketupat sakala hari Lebaran.,Warga muslim mengadis ke mall.,"Idul Fitri tiba, warga muslim mengadis ke mesjid",Orang-orang mengadis ke mesjid sakala waktu,"Di mesjid, orang-orang baca Al-Quran, shalat, sareng bersama-sama","Namun, warga muslim teu tiasa ngucap du’a di Idul Fitri"
Religious Holiday,Warga muslim ngucap du’a shalawat Ibrahim di Idul Fitri.,Anak-anak mendekati mimpi buruk.,"Natal tiba, anak-anak mendekati mimpi nyata",Anak-anak kudu mendekati mimpi nyata sakala malam,"Di mimpi nyata, anak-anak makan biskuit, olahan cokelat, sareng nongkrong","Tapi, anak-anak teu tiasa bermain gadget di hari Natal"
Religious Holiday,Anak-anak makan turkey sakala hari Natal.,Budhaguna mengadis ke kolam renang.,"Waisak tiba, budhaguna mengadis ke candi Borobudur",Budhaguna mengadis ke candi Borobudur sakala waktu,"Di candi Borobudur, budhaguna baca Dhammapada, bersama-sama, sareng bermeditasi","Namun, budhaguna teu tiasa ngucap mantra di Waisak"
Religious Holiday,Budhaguna ngucap mantra Mettā di Waisak.,Tionghoa mengadis ke belanja.,"Di hari Imlek, tiga hari bersama, Tionghoa mengadis ke temple",Tionghoa mengadis ke temple sakala waktu,"Di temple, Tionghoa baca Zodiac, shalat, sareng bersama-sama","Tapi, Tionghoa teu tiasa makan cap cai di hari Imlek"
Religious Holiday,Tionghoa makan cap cai sakala hari Imlek.,Umat Kristen mengadis ke kebun binatang.,"Di hari Paskah, Yesus kelahiran lagi",Umat Kristen mengadis ke gereja,Umat Kristen mengadis ke gereja sakala waktu,"Di gereja, umat Kristen baca Injil, shalat, sareng bersama-sama"
Religious Holiday,Gadis Sunda ngabungun eyangna wong tuanya sareng tradisi sarasehan.,"Setelah maghrib, keluarga terjungkir ke restoran.",Keluarga Sunda berkumpul di hari raya Idul Fitri,"Mangsa puasa di bulan Ramadhan, ngaji surah quran",Kaum wanita ngadis dina masakan tradisional,"Setelah maghrib, keluarga berbuka puasa bersama"
Religious Holiday,"Setelah maghrib, keluarga makan bersama di meja panjang yang dihiasi.","Setelah selesai, penjor dibakar.",Sekolah Sunda menggelar pesta upacara Galungan,Siswa-siswi diberi tugas membuat penjor,Ornamen penjor dibuat dari barang-barang alam,"Setelah selesai, penjor dipatung di depan rumah"
Religious Holiday,"Setelah selesai, siswa-siswi berkumpul menggelar acara bersama.",Seluruh warga desa bertengkar.,Warga Desa Sunda bersedia mengadis Nyai Pohaci,Para ibu-ibu menyiapkan makanan tradisional,Pemuda-pemuda memancing ikan di sungai,Seluruh warga desa berkumpul di padepokan Nyai Pohaci
Religious Holiday,Seluruh warga desa bersenang-senang bersama menyambut hari raya.,Seluruh keluarga tidak suka makan ketupat.,Anak-anak Sunda mengumpulkan bahan-bahan untuk membuat ketupat,Ibu mengajar anak-anak cara membuat ketupat,"Setelah selesai, ketupat dipanggang di atas api",Seluruh keluarga bersenang-senang makan ketupat bersama
Agriculture,Alfin nyampeun ka pasar ngarapkeun tempe kaian sareng sambalannya.,Si Eka dan saklawarganya nganggokeun padi nu cipo.,Si Eka dan saklawarganya nyaritakeun padi di sawah,Padi anu nu padiakin ka sawah bakal dicampurkeun ka beras,Beras anu nu dipadakeun ka menu makanan,Si Eka manggaurkeun ka padi saklawarganya
Agriculture,Si Eka dan saklawarganya ngaliwatkeun padi sareng bantuakeun padianya.,Santi ngulikakeun kawung ka tegalan nganti kawungna cipo.,Si Santi nyoba ngusir kawung ka tegalan,Santi ngasih kawung ka tetek,Kawung anu nu kena tetekna bakal dicampurkeun ka produk kue,Produk kue anu nu dipadakeun ka menu makanan
Agriculture,Santi nyampeun ka warung jualan nggeretkeun kawung sareng produk kueannya.,Si Dini nganggokeun jagung nu cipo sareng tepung jagungnya.,Si Dini nyaritakeun jagung di sawah,Jagung anu nu jagungakin ka sawah bakal dicampurkeun ka tepung jagung,Tepung jagung anu nu dipadakeun ka menu makanan,Si Dini manggaurkeun ka jagung saklawarganya
Agriculture,Seno ngerti arti upacara ngajih sak si Bapa mengajarkannya tentang nilai-nilai budaya Sunda.,Dewi mau ngejarkan tanah lain sareng masih ora berhasil.,"Dewi teh anak perajak, iki saorang budak yang kudu ngasari padi",Dewi geus nakali padi sareng ora berhasil,Dewi teu tiasa ngerti alasannya,"Dewi ngomongi sak si Mbah, anjeun kula hadé sak padi"
Agriculture,"Dewi ngerti alasan mangko padi ora berhasil, karena dia ora mengikuti tradisi saat ngasari padi.",Santosa ngasari tanaman lain sareng masih ora berhasil.,"Santosa teh ibu syuaib, iki saorang ibu yang kudu ngasari tanaman","Santosa geus nakali tanaman kanggo mangan, tapi tanaman tuwi kana ora berhasil",Santosa teu tiasa ngerti alasannya,"Santosa ngomongi sak si Anak, anjeun kula hadé sak tanaman"
Agriculture,"Santosa ngerti alasan mangko tanaman tuwi ora berhasil, karena dia ora ngapain tradisi saat ngasari tanaman.",Mira ngasari tanaman lain sareng masih ora berhasil.,"Mira teh anak pedagang, iki saorang budak yang kudu ngasari tanaman","Mira geus nakali tanaman kanggo mangan, tapi tanaman tuwi kana ora berhasil",Mira teu tiasa ngerti alasannya,"Mira ngomongi sak si Ayah, anjeun kula hadé sak tanaman"
Agriculture,Anak-anakna ngomong-ngomong sambil mengadep padi dengan bijaksana.,"Padinya, padi Wawasan hanyut, saja saja sahuran.","Sang Hyang Eka ngucapkan, ""Siapa yang ngadep padi dengan hati, ia akan mendapat hasil yang banyak",""" Saat ngadep, Wawasan bakal ngadep dengan hati",Wawasan berharap bisa mendapat hasil yang banyak,"Namun, dia ngadep terlalu dalam"
Agriculture,"Padinya, padi Wawasan merahusus, saja saja sahuran, tetapi Wawasan mendapat hasil yang lebih banyak.","Mas Dika hilang bijaksana, dia hilang semua padi yang disimpan.","Usai panen, Mas Dika bakal ngasih sebagian hasil panen kepada orang tua","Namun, dia teu bakal ngasih semua padinya",Mas Dika bakal menyimpan beberapa padi untuk diburu,"Namun, dia teu bakal perhatiankan jumlah padi yang disimpan"
Fisheries and Trade,"Eka ngabédah ka Tuhan, langsung ikan langsung hadap Eka nu ngasih-ngasih.","Eka ngomongkeun ka ibunya, ibunya ngomong ka Eka éta minangka ikan langsung usai melarikan.",Eka langkung kolot 3 bulan teu sami di tira-tiranya wangi ikan,Eka teu sadar anggeuna ikan langsung hilang,"Eka nyampeurkeun ka pasar ikan, tapi ikan-ikan langsung lari kaget","Eka ngomongkeun ka ibunya, ibunya nyatain anggeuna ikan teu ada di kolot Eka"
Fisheries and Trade,Yuda buta warna ikan.,Yuda mangrupikeun pelukis anu ngartos rupa-rupa warna ikan.,Yuda teu bisa nendhah warna ikan,Yuda geus ngalaman kalainan ti manehna leutik keneh,Yuda sedih ngeunaan kalainan anu dideritana,Yuda teu tiasa ningali warna ikan sareng jelas
Fisheries and Trade,Sari gura-giru hayang nepungan Bapak nu geus mangtaun-taun teu kadéngé.,Sari rék nganjang ka imah Bapak.,Sari naék hujan kana motorna,Hujan teu ngecrék teuing,Sari kakara meunang telepon ti Ina,"Ina ngabéjaan yén Bapak, misanna Sari aya di imahna"
Fisheries and Trade,Pak Saputro nyokot bahan ti pasar.,Bu Dewi rék nganjang paruwes ke warung makan.,Bu Dewi ngajualan paruwes di pasar,"Paruwes teukeun kacarageun, teukeun santen",Bu Dewi manggawekakeun paruwes ka warung makan,Bu Dewi ngajualakeun paruwes kanggo warung makan
Fisheries and Trade,Bu Dewi nyokot bahan ti warung makan.,Pak Suprianto indit meuli ikan-ikan ke tukang ikan.,Pak Suprianto ngendak ngampek ikan-ikan di kolam,"Kolam teukeun air segar, teukeun tanaman",Pak Suprianto manggawekakeun ikan-ikan ka kandang,Pak Suprianto ngajualakeun ikan-ikan
Fisheries and Trade,Pak Suprianto nyokot bahan ti kandang.,Bu Sri rék nganjang telur ikan ke rumah.,Bu Sri ngajualan telur ikan di pasar,"Telur ikan teukeun warna kuning, teukeun segar",Bu Sri manggawekakeun telur-telur ikan ka rumah,Bu Sri ngajualakeun telur ikan kanggo rumah
Fisheries and Trade,Bu Sri nyokot bahan ti rumah.,Pak Santoso indit meuli ikan-ikan ke kamar mandi.,Pak Santoso nganggo pasar ngiacakakeun ikan-ikan,"Ikan-ikan teukeun segar, teukeun banyak",Pak Santoso manggawekakeun ikan-ikan ka kamar mandi,Pak Santoso ngajualakeun ikan-ikan
Art,Ida tiasa ngabagi upinan iku,Dian ngamen kentongan ka lalapan,Dian membutuhkan uang ka belanjaan pangan,Dian ngajual sukeun kentongan daerah,Dian teu ngerti cara ngamen sukeun kentongan,Dian nyimpen uang
Art,Dian teu kawasa sukeun kentongan,Santi geus kawasa puisi,Santi nanggapin kawinan anakna,Santi ngasari ngajan lagu daerah,Santi teu nyawain artis,Santi nulis puisi
Art,Santi tiasa ngajar puisi ka bocah-bocah,Doni teu tau cara ngajual kostum,Doni nikmati tari daerah ka panggung,Doni teu nyawain artis tari,Doni ngajualan kostum tari,Doni nulis puisi
Art,Doni tiasa ngajar tari ka bocah-bocah,Wawan geus kawasa tiket,Wawan nakileupak gamelan ka hari raya,Wawan teu nyawain artis,Wawan ngajual tiket kecakaran,Wawan teu daékeun
Art,Budi menangkompetisi gamelan dengan berkat kerjasama sahabat-sahabatnya.,Sumiati lupa suaranya rebab.,Sumiati nikmati musik rebab saur,Sumiati ngajak teman-teman nikmati rebab saur,Sumiati ngamongkeun rebab sakuwonan,Sumiati ngasorakeun musik rebab
Art,Sumiati dan teman-temannya menikmati rebab saur dengan gembira.,Santosa tidak menghargai budaya lokal.,Santosa ngajak nganggo pesta upacara suwungan,Santosa ngucapkeun pujian kepada Tuhan,Santosa ngasorakeun tari tradisional,Santosa ngucapkeun pujian kepada para penyanyi
Art,Santosa menghargai budaya lokal dan menyambut pesta upacara suwungan dengan hormat.,Wulan tidak mengerti arti puisi Sunda.,Wulan nikmati puisi Sunda,Wulan ngajak teman-teman nikmati puisi Sunda,Wulan ngamongkeun puisi-puisi Sunda,Wulan ngucapkeun pujian kepada para puisi
Art,Wulan dan teman-temannya menikmati puisi Sunda dan memahami nilai budaya yang terkandung di dalamnya.,Adi menghancurkan angklungnya.,Adi nikmati alat musik angklung,Adi ngajak teman-teman nikmati angklung,Adi ngasongkeun angklung sakuwonan,Adi teu bisa mendapatkan suara yang harmonis
