topic,correct_ending,incorrect_ending,sentence_1,sentence_2,sentence_3,sentence_4
Wedding,Putri ngucapkeun kasihan samua saudara-saudara nyaeta ka kawin.,Agung mundhé bendo ka kawin.,Agung manggaweun bendo ka kawin,"Agung teu bisa nganti-nganti ka bendo, tetapi dia ngga bisa nguruskeun bendo",Agung teu bisa nakapanggil samua ora-ora nyaeta ka kawin,Agung teu bisa nguruskeun bendo ka kawin
Wedding,Agung ngucapkeun kasihan samua ora-ora nyaeta ka kawin.,Sari mundhé sarí ka kawin.,Sari manggaweun sarí ka kawin,Sari teu bisa nganti-nganti ka sarí,Sari teu bisa nakapanggil samua saudara-saudara nyaeta ka kawin,Sari teu bisa nguruskeun sarí ka kawin
Wedding,"Salsabila ngasih undangan sesukanya, sareng mengantisipasi kebutuhan sarasehan.","Salsabila ngasih undangan kebanyakan saé, sampai sarasehan teu bisa nyangguk.",Salsabila mangadangan pepakemban bingkisan nisan,Anjeunna ngasih banyak undangan,Sarasehan teu kagum,"Tapi, banyak undangan, manggaran nu sajanan teu cukup"
Family Relationships,Sari ngajari kanca kapanggih.,Santosa hapus kajenan keluarga.,Santosa kajenan keluarga,Santosa langkah ngedep ka kajenan,"Wanakna kajenan kadhateng, ngajetan ka Santosa",Santosa ngadukung kaputusan kajenan
Family Relationships,Santosa senggen kajenan keluarga.,Ratih ngaringkeun mamaké teu kasukuran.,Ratih nakapa mamaké sakola,Ratih kadhateng anjeunna kasukuran,"Anjeunna kasukuran mamaké, kelakon ka Ratih",Ratih ngajari mamaké kafa-kafané
Family Relationships,Ratih ngajari mamaké kafa-kafané.,Iwan hapus kajenan sabará.,Iwan kajenan sabará,Iwan ngajualan ka kajenan sabará,"Wanakna kajenan sabará, ngajetan ka Iwan",Iwan kasindiran kajenan sabará
Family Relationships,Iwan senggen kajenan sabará.,Mira ngaringkeun huwusan teu kasukuran.,Mira kadhateng nakapa huwusan,Mira langkah ngedep ka huwusan,"Wanakna huwusan kadhateng, ngajetan ka Mira",Mira ngajari huwusan kafa-kafané
Family Relationships,"Budi ngunjing indungna, teu ékak kajenan lagi","Susi nyaléhkeun mertunana, mangga mertunanakeun mertua",Susi nyaéta anak mertua,Susi teu rindu mertunana,Susi kagum tur ngidolakeun mertunana,Susi nyantos ngajari mertunana
Family Relationships,"Susi nakuli mertunana, kuwéci mertuakeun","Rangga nganti jadi berek, tapi berekna Rangga ngadeg sareng ngenget",Rangga teu nyambung berek anak,"Rangga ngajari berekna, ngenget, jeung ngadeg",Berekna Rangga ngadeg sareng ngenget,Rangga teu nyadaraken berekna ngadeg sareng ngenget
Family Relationships,"Rangga jadi ayam, berekna Rangga ngadeg sareng ngenget","Ayu nyaléhkeun hantamananana, mangga hantamananakeun",Ayu teu tau ngadeg sareng tiasa nyambung hantamananana,Ayu kadhatos ngadeg sareng hantamananana,Ayu teu nyangka hantamananana kadhatos ngadeg,Ayu teu rindu hantamananana
Family Relationships,"Ayu ngajari hantamananana, kuwéci hantamanakeun","Santi nganti jadi kawinan, tapi Santi teu rindu mertunana",Santi téh anak kawinan,Santi teu nyambung serba-serbi kawinanana,Santi kagum tur ngidolakeun kawinanana,Santi teu rindu mertunana
Pregnancy and Kids,Euis teu bisa ngelés-élésakeun anak-anakna,Prabu Sucipto geus ditimbangakeun hukum,Prabu Sucipto geus kawin kanggo Putri Galuh,"Saat ngidih, Putri Galuh geus hamil",Prabu Sucipto geus panganten kanggo saeunak kaca-kaca,Putri Galuh geus diberi banyuang iwak
Pregnancy and Kids,Putri Galuh geus beranak anak kesayuan,Ni Luh geus ditimbakakeun hukum,Ni Luh geus nikah kanggo Bapak Mas,"Saat hamil, Ni Luh geus ngeluruh sarean",Ni Luh geus tiasa nanggungkeun anaknya kaseh,Bapak Mas geus ngandongkeun anaknya sak siang
Pregnancy and Kids,Anaknya geus ngajani sara kanggo ibu,Sari teu ditimbakakeun hukum,Sari geus ngandongkeun anak kanggo Pasundan,Anaknya geus kudu ngandangkeun saka kawinan,Sari geus dileongkeun saka pangkerjaan,Anaknya geus tiasa nandangkeun sak ibu
Pregnancy and Kids,Anaknya geus ngajani sara kanggo ibu,Saripah teu ditindasakeun kasus kepolisian,Saripah geus dianggokeun saeunak kaca-kaca,"Saat dibelit, Saripah geus hamil",Saripah geus ngandongkeun anaknya sak bapaknya,Saripah geus tiasa ngandangkeun anaknya sae
Pregnancy and Kids,Japatina nyaah pisan ka euis,Japatina Euis leungit,"Euis nu sipamitra sasandingana, iki waktu nu nyeréntak ka japatina",Euis nyaritakeun loba hal ka japatiningsih,"Japatina mreréngékeun tuwuh, iki ulang ka umur tiga bulan",Japatina sering ngajalangi tapi ngajalangi ka bumi
Pregnancy and Kids,Manéhna ngajual hasil pagawéanana ka babaturanana,Imah Wiranti kacida pikasieuneunana,Wiranti resep ngumpulkeun barang-barang bekas di kamar anak,"Wiranti ngumpulkeun mainan, baju anak, serta buku pribadinya",Wiranti ngabersihkeun barang-barang anu dianggo sareng janten pernak-pernik anu unik,"Samentara éta, Wiranti nyimpen barang-barang bekas anu teu acan dianggo di lekos khusus"
Pregnancy and Kids,Dwiki henteu hilap mésér takjil di dinya salami bulan Ramadhan.,Dwiki henteu hilap ngalaksanakeun solat tarawih di masjid salami bulan Ramadhan.,Dwiki sering meuli takjil di masjid deukeut imahnya,Aya rupa-rupa takjil anu dijual,"Aya kolek cau, rupa-rupa gorengan, jeung sababaraha rupa inuman es",Karesep Dwiki nyaéta es jeruk sareng kerepek pisang
Pregnancy and Kids,Aranjeunna siap-siap ngahadiran kawinan misan Mira make saragam batik.,Ayeuna aranjeunna siap pikeun indit ka rumah sakit.,Pakéan nu dipaké Mira nyaéta kain batik kuning jeung perak,Mira jeung kolotna maké kain batik anu warna jeung corakna sarua,Indungna maké kain batik jadi bawahan kebaya kuning beureum,Bapa make kaos lengan panjang nu sarua jeung Mira
Pregnancy and Kids,Yusuf hoyong terang awakna idéal atau henteu,Yusuf teu boga timbangan di imah,Yusuf hayang apal beurat badan manehna,Yusuf néangan timbangan di imahna,Yusuf nimbang awakna dina timbangan digital,Yusuf ngitung beuratna dibandingkeun jeung jangkungna
Death,Eka ngucap saranan saur mati.,Sari ngasih saur mati kepada anak.,Sari mosiak saur mati duitna anak,Sari teu sadar saur mati teu manggadi bukuhan,Sari ngomong-ngomong sakanjen kalayan sari,Sari teu mosiak anak saur mati
Death,Sari mosiak anak kepada saur mati.,Santi ngasih saur mati kepada teman-temannya.,Santi ngajalah pakon saka saur mati,Santi nyerah sareng teman-temannya,Santi dijagok saur mati karo Santi,Santi ngumpet padha pakon saka saur mati
Death,Santi ngucap saranan kepada teman-temannya.,Asep ngasih saur mati kepada istri.,Asep sibal mati karo istri,Asep teu sadar saur mati teu bisa dijual,Asep dijagok saur mati karo istri,Asep ngomong-ngomong istri karo saur mati
Death,Asep ngelontorkan warisan kepada istri.,Dewi ngasih saur mati kepada teman-temannya.,Dewi teu mosiak saur mati,Dewi nyampeun ka tedha saur mati,Dewi teu tau tradisi saur mati,Dewi ngomong-ngomong kepada teman-temannya
Death,Tarungan éta disempokeun ka alam.,Nyai Gede dijadikan patung ka dalan.,Nyai Gede iki teu mboten ngajalah ka jenaka,"Nyai Gede ka manggaleun ka tatah, ka dor","Ototna ngagelar, udah sak sihir","Nyai Gede ngagetik ka bak, ""Wong nu kawula, kula adil"
Death,Nyai Gede dikebonkeun ka kuburan.,Dinda mamancang ka nak lagi.,"Dinda teu tiasa mamancang ka bak, udah manggaweun ka kuburan","Mamanghang ka kuburan, dipandangé ka nak","Dinda teu tiasa leubah ka nak, udah sak sihir","Tiasa teu mamancang, kuring langsung dijuluki ""Akih"""
Death,"Si Poh diulukkeun ""Akih"".",Dara mamancang ka nak lagi.,"Dara teu tiasa mamancang ka bak, udah manggaweun ka kuburan","Mamanghang ka kuburan, dipandangé ka nak","Dara teu tiasa leubah ka nak, udah sak sihir","Tiasa teu mamancang, kuring langsung dijuluki ""Akih"""
Religious Holiday,"Dédi ngamret-amretan ka pikulan kawula, lalu dédi teu nangisakeun.","Ida ningkus duit ka bale, malahan duitna ngga cukup.",Ida sondol ka jagoan saputangan,Ida teu bakal kaso bakulan,Ida ningkus duit ka bale,Ida ngamret-amretan ka pikulan kawula
Religious Holiday,"Ida ningkus duit ka bale, lalu Ida teu jagoan saputangan.","Raka ngajajah ka tarik pangestu, malahan pangestuna ngga ada.",Raka ngadeg ka santap ka bulan,Raka teu bakal tiasa kaso,Raka ngamret-amretan ka pikulan kawula,Raka ngajajah ka tarik pangestu
Religious Holiday,"Raka ngajajah ka tarik pangestu, lalu Raka teu kaso.","Santi sajiken bakul duit ka bale, malahan duitna ngga cukup.",Santi ngajajah ka tarik pangestu,Santi teu bakal tiasa kaso,Santi sajiken bakul duit ka bale,Santi ngamret-amretan ka pikulan kawula
Religious Holiday,"Santi sajiken bakul duit ka bale, lalu Santi teu kaso.","Ade ngamret-amretan ka pikulan kawula, malahan duitna ngga cukup.",Ade ngadeg ka santap ka bulan,Ade teu bakal tiasa kaso,Ade sajiken bakul duit ka bale,Ade ngamret-amretan ka pikulan kawula
Agriculture,Sari émbang ka énggal kanggo nganti gundul.,Cika ngajalungkeun ka kawungan kanggo gampang.,Cika ménta cirebon ka kawungan,Cika teu ngadanggeun kawungan,"Endha cebong, ngadiring ka kawungan",Cika geus nyalunggeun ka kawungan
Agriculture,Cika ngajalungkeun ka kawungan kanggo nganti buas.,Budi émbang ka énggal kanggo nganti hujan dereng.,Budi émbang salakuna ka énggal,Budi ngadiring ngadéngé ka énggal sareng bajul,Budi geus manggung manéh ka énggal,"Budi cebong, ngadiring ngadéngé ka énggal"
Agriculture,Budi émbang ka énggal kanggo nganti gundul.,Santi ngajalungkeun ka énggal kanggo gampang.,Santi ménta ka énggal,Santi ngadiring ngadéngé ka énggal sareng bajul,Santi geus manggung manéh ka énggal,"Santi cebong, ngadiring ngadéngé ka énggal"
Agriculture,Santi ngajalungkeun ka énggal kanggo nganti buas.,Heri émbang ka énggal kanggo nganti hujan dereng.,Heri ngagungkeun ka énggal,Heri ngadiring ngadéngé ka énggal sareng bajul,Heri geus manggung manéh ka énggal,"Heri cebong, ngadiring ngadéngé ka énggal"
Agriculture,Émbuakna Eka berhasil matur sareng banyak.,Sari teu tinggal hanyak sindiran.,Sari teu mangga kana sindiran di sawah,Sari teu tara bakal dikecur waktu menggali tanih,"Sari ngasih makan ka burung, ngasih makan ka semua burung","Sari ngasih bakti ka Allah, ngasih makan ka burung-burung"
Agriculture,"Sari teu tidak dikecur lagi, mangga-mangganya matur.",Padinya Dedi hanyak dikecur semua.,Dedi teu kabamba kana padi di sawah,Dedi teu tara bakal pisan waktu panen,"Dedi ngasih bakti ka Allah, ngasih panenan padinya ka saudara-saudaranya",Dedi pasrah kana kersa Gusti
Agriculture,"Padinya Dedi pisan, diberiakan kepada saudara-saudaranya.",Pisang Rina hanyak gagal semua.,Rina teu pisang kana tanaman di kebun,Rina teu tara bakal gagal waktu tanam,"Rina ngasih bakti ka Allah, ngasih tanamanan pisangnya ka tetangga",Rina pasrah kana kersa Gusti
Agriculture,"Pisang Rina berhasil matur, diberiakan kepada tetangga.",Kentang Bondan hanyak dikecur semua.,Bondan teu kentang kana tanaman di sawah,Bondan teu tara bakal banyak hama waktu budidaya,"Bondan ngasih bakti ka Allah, ngasih rawonan kentangnya ka ibu-ibunya",Bondan pasrah kana kersa Gusti
Agriculture,Budi gura-giru hayang nepungan Pak Cik nu geus mangtaun-taun teu kadéngé.,Eko teu bisa indit ka pamakaman ibunya.,Eko terakhir kalina nempo jenazah ibunya,Eko teu nyangka yén kamarinya téh poé pamungkas manéhna nempo ibunya,Eko nginget-nginget seuri ibunya dina ingetanana,Eko ceurik teu daékeun
Agriculture,Eko kacida hanjakalna ku kepergian ibunya.,Isyah teu dihukum ku guru.,Dewi murid kedah nganggo pakean anu rapih sareng lengkep,Isyah poho make dasi jeung sabuk,Isyah panik jeung hariwang,Wulan nginjeumkeun dasi jeung sabuknya nu séjén
Agriculture,Wulan teu diberi nasihat ku guru.,"Rupana, Sari poho mayar séwa palampung.",Sari sareng keluarganya nuju wisata ka wahana wisata tanaman,Anjeunna sumanget pisan pikeun nyobaan sorodotan tanaman nu pangjangkungna di dinya,Manehna buru-buru nyokot pelampung nu deukeut,Ujug-ujug aya nu ngageroan Sari
Agriculture,Sari poho ngajak keluarganya bersama nyoba tanaman.,Pepelakan nu dirampa ku Nana bakal paeh.,Nana geus sababaraha kali nyobaan melak kentang,Hanjakal anjeunna sok gagal,Anjeunna nyobian tumuwuh tina siki,Anjeunna ogé parantos nyobian miara bibit leutik
Fisheries and Trade,Wiwit ngajadjahakeun ikan ka dhuwur,Sri ngasarheun ka badakan Budi,Budi ijab pesanggrahan ka Sri,Sri nu bak mandi ka air matahari,Budi ngasarheun ka badakan Sri,Anjeunna soré ka pasar ngadahan udang
Fisheries and Trade,Budi ngajadjahakeun udang ka dhuwur,Babi ngasarheun ka badakan Euis,Euis nu mangan ka lampah,Euis nu bak mandi ka udan tujuh,Euis nu pisan ka balong lauk,Anjeunna soré ka pasar ngadahan babi
Fisheries and Trade,Euis ngajadjahakeun babi ka dhuwur,Prabu ngasarheun ka badakan Sinta,Sinta bak mandi ka air matahari,Sinta nu ngasarheun ka badakan Prabu,Prabu nu bak mandi ka udan lamtoro,Anjeunna soré ka pasar ngadahan sate
Fisheries and Trade,Sinta ngajadjahakeun sate ka dhuwur,Raka ngasarheun ka badakan Dian,Dian bak mandi ka udan tujuh,Dian nu ngasarheun ka badakan Raka,Raka nu bak mandi ka air matahari,Anjeunna soré ka pasar ngadahan ayam
Fisheries and Trade,Euis mimiti diajar hijrah.,Raka nari jeung Andri bari saré.,Raka saré,Andri ngaganggu Raka,Raka teu bisa neruskeun saré,Andri ngajak Raka nari
Fisheries and Trade,Andri ngahudangkeun Raka nu keur saré.,Santosa teu sakola.,Santosa pernah digawé salaku loker ikan,Santosa ngalungkeun ikan ka pasar,Santosa digawé ti isuk nepi ka warung,Santosa indit ka sakola sore
Fisheries and Trade,Santosa tiasa ngabagi waktosna antara padamelan sareng diajar.,Putri ukur hayang fokus kana kagiatan akademikna.,Putri ngiringan seueur kagiatan,Putri kudu bisa nyaimbangkeun akademik jeung kagiatan,Putri gaduh manajemén waktos anu saé,Putri tiasa ngaréngsékeun sadaya pancén kalayan saé
Fisheries and Trade,Putri tiasa nyaimbangkeun akademik sareng kagiatan kalayan saé.,Dedi geus jangji rék meuli sapatu olah raga anyar.,Suku Dayak tijalikeuh,Dayak labuh pas maen olah raga tadi isuk,Ayeuna sukuna nyeri nalika leumpang,Dayak sore ka klinik kampus bareng Dedi olah raga Dayak
Art,"Rahayu ngucap, ""Sok ayeuna gitu, wong iki nu manggaweun musik! Aku saja mau ngucap, supaya wong iki nu mau mengucap, maka mamungsa!""","Dina rék ngucap, ""Sok ayeuna gitu, wong iki nu kentrung! Aku mau nyebarakeun kentrung iki!""",Dina émbang gaduh saorang tukang kentrung,Dina nagaduh saorang tukang kentrung itu,Dina ngagasah wong kana wedok,"Dina ngucap, ""Sok ayeuna gitu, wong iki nu kentrung!"""
Art,"Dina ngucap, ""Sok ayeuna gitu, wong iki nu kentrung! Aku saja mau ngajajah, supaya wong iki mau ngajajah!""","Santosa rék ngucap, ""Sok ayeuna gitu, wong iki nu mamanggung sajak Sunda! Aku teu saja mau mamanggung!""",Santosa émbang bicara saka kebudayaan Sunda,Santosa ngomong saorang orang kana kebudayaan Sunda,Santosa ngagasah wong kana wedok,"Santosa ngucap, ""Sok ayeuna gitu, wong iki nu mamanggung sajak Sunda!"""
Art,"Santosa ngucap, ""Sok ayeuna gitu, wong iki nu mamanggung sajak Sunda! Aku saja mau ngajajah, supaya wong iki mau ngajajah!""","Agung rék ngucap, ""Sok ayeuna gitu, wong iki nu manggaweun gamelan! Kalau ngkak ngucap, aku teu mau ngucap!""",Agung émbang ngajalan saorang penggaray tradisional,Agung ngajalan saorang penggaray tradisional itu,Agung ngagasah wong kana wedok,"Agung ngucap, ""Sok ayeuna gitu, wong iki nu manggaweun gamelan!"""
Art,"Sitti nakileupas angklung sakapa teu dijajal, sitti angguk ku angklung nu mampir pada saiki.",Dédi mboten nakilik srepegan.,Dédi manggaweun srepegan,Dédi ngajual srepegan ka gendhing Sunda,Dédi bakal kajenget éta srepegan kalian,Dédi nakilik saiki karo wong Sunda
Art,"Dédi nakilik saiki karo wong Sunda, wong Sunda éta ngasem pada dédi, ""Dédi, kajenget éta srepegan sakapa kawula!""",Éka nganti karo tali rondó.,Éka dyeret ka kelas tiga,Éka ngajual tali rondó,Éka nakicari ka tali rondó nu pisan,Éka nakapecah karo tali rondó
Art,Eka ditemukan oleh guru Sunda.,Putri ngga dihormati oleh orang tua.,Putri ninggalkeun seni lukis kuno,Putri geus teu ngerti manfaatnya,Putri manggawe saka hati,Putri ngasih kepada orang tua
Art,Putri dijadikan seniman resmi desa.,Dede dibekukan polisi.,Dede nulis puisi tentang kebudayaan Sunda,Dede bakal diikutinya para seniman,Dede geus teu bisa mendapatkan uang,Dede nakal mengumpulkan uang
Art,Dede mendapatkan hadiah besar.,Agus ngga bisa belajar gendang.,Agus latih gendang Sunda,Agus geus teu bisa ngelatih,Agus nangis sakit hati,Agus bertemu dengan guru gendang tua
Art,Agus jadi gendang nanggroe.,Sari dibekukan polisi.,Sari mau belajar tari Sunda,Sari geus teu punya guru,Sari cari guru tari di desa,Sari nakal mencuri senjata
Traditional Games,Santi kembali bakal ngetan gendang kajen dina acara tradisional.,Bagus mau beli konde keren buat pamer.,Bagus suka ngerotong konde,Bagus ngelamun konde di tengah-tengah keluarga,Bagus ngga bisa mengenal macam-macam konde,Bagus mau nyoba konde baru
Traditional Games,Bagus kembali mampu mengenal dan membedakan konde-konde tradisional.,Adi hancurkan permainan congklak.,"Dina hari raya, Adi suka bermain congklak",Adi ngajak bibirnya bermain congklak,Adi gak bisa menang di game congklak,Adi marah dan mau menyerahkan
Traditional Games,Adi belajar strategi baru dan terus bermain sampai bisa menang.,Ayu hilang minat bermain badminton.,Ayu suka ngetan badminton,Ayu ngajak temen-temen bermain badminton di lapangan sekolah,Ayu musibah terjebak di badan,Ayu ragu bermain lagi
Traditional Games,Ayu terus belajar teknik badminton dan kembali bermain dengan hati-hati.,Edo hancurkan engklek tersebut.,Edo suka bermain engklek,Edo ngajak temen-temen bermain engklek di tepi sungai,Edo kehilangan segalanya saat main engklek,Edo marah dan mau menyerahkan
Traditional Games,"Dina ngajual balap karung, ngaseut ka maraton.","Dina nakalakeun ka teman naon, tapi diporosé.",Dina nakali ngajalang giring,Dina nggereténgékeun nu pangarep,"Dina nakali éta yaap, mboten nangis",Dina nakalakeun ka teman naon
Traditional Games,"Dina ngajual giring, dipuja ka teman naon.","Dina ngajalang engklek, tapi terjatuh.",Dina ngajalang engklek,Dina nggereténgékeun nu bakti sudjan,"Dina ngajalang engklek ka bumi, mboten nangis",Dina ngajalang sampai terang jalan ka hurnal
Traditional Games,"Dina ngajual engklek, dipuja ka hurnal.","Dina ngajalang congklak, tapi kalah.",Dina ngajalang congklak,Dina nggereténgékeun nu batu cédok,"Dina ngajalang congklak ka teman, mboten nangis",Dina ngajalang sampai terang jalan ka hurnal
Traditional Games,Saudara wong tiri hoyong engklekna,Dede ngampeus congklakna,Dede kalajuan ka congklak,"Dede kadatangan ka ponggok, nggawe kaget","Sesongongan congklakna, Dede kaget",Dede ngampak saudara wong tiri di sisi
Traditional Games,Dede hoyong congklakna sareng saudara wong tiri,Anak-anak ngampus topengna,Sekelompok anak pesen topeng,Ada anak yang ngarep topeng cakil,Ada anak yang ngarep topeng bilung,Ada anak yang ngarep topeng daplak
Traditional Games,Anak yang ngarep topeng daplak hoyong topengna,Asep ngampeus gasingna,Asep kalajuan ka gasing,Asep kagum sareng nikmat ka gasing,Gasing Asep geus hilang,Ada anak lain yang ngapanggil Asep
Traditional Games,Asep hoyong gasingna sareng anak lain,Sari ngampeus marbadangna,Sari kalajuan ka marbadang,Sari ngarep badan agak rapih,Ada anak lain yang mau ngarep sareng Sari,"Tapi, badan anak lain lebih rapih dari Sari"
Daily Activities,Eka ditunggu-tunggu saking kumpulan karena suara alus,Andra teu bisa dibeli sate karena ngarsangkeun bakso,Andra nyaeta ka pasar kelaparan siang,Anjeuna ngarsangkeun sate ka satean,Andra digawé ka pedagang bakso,Andra ngarsangkeun sate ka satean lain
Daily Activities,Andra diterima beli sate ka satean lain,Sari teu dianggo kelas karena ngawé ke belakang,Sari pernah digawé ka kursi ketua kelas,Sari ngawékeun kursi di belakang,Sari digawé ka teman lain,Sari ngawékeun kursi di belakang lagi
Daily Activities,Sari diundang ketua kelas lagi karena keikhlasannya,Adi teu bisa ikut lomba karena teman lain,Adi suwunkeun kapala hiji organisasi olahraga,Adi nyaeta kapala hiji organisasi kesenian,Adi jeung teman lain dina widang béda,Adi teu tiasa gabung teman lain
Daily Activities,Teman lain maksa Adi asup kana organisasina,Santi teu diundang ke rapat karena ngarsangkeun membaca buku,Santi nyaéta kapala hiji organisasi remaja,Dina widang béda sareng teman lain,Santi ngarsangkeun membaca buku di taman,Santi teu tiasa bercakap sareng teman lain
Daily Activities,Ayu menambah wawasan tentang budaya Sunda.,Euis jatuh dan motor rusak.,Euis nyaeta motor baru,Euis tergiur motor itu karena cantik dan cepat,Euis ngajjang motor itu dina tengah jalan,Euis ngga ngerti cara mengendarai motor
Daily Activities,Euis belajar cara mengendarai motor dengan bijaksana.,Hasil kebun Mbah Suri gagal panen.,Mbah Suri ngajjang kebun setiap hari,Mbah Suri ngejaganya dina siang hari dan ngejengnya dina sore hari,Mbah Suri ngga pernah mau tidur sore hari,Mbah Suri ingin memanen hasil kebunnya
Daily Activities,Hasil kebun Mbah Suri panen dengan baik.,Bima dan Dewi sakit setelah olahraga.,Bima dan Dewi nggerayani kegiatan olahraga setiap pagi,Bima dan Dewi ngajjang jogging dina taman,Bima dan Dewi ngga pernah ngurusin olahraga ketika hujan,Bima dan Dewi suka olahraga karena sehat
Daily Activities,Bima dan Dewi sehat dan bahagia setelah olahraga.,Sari gagal memasak lauk-pauk Sunda.,Sari nggerayani kegiatan memasak setiap sore hari,Sari ngajjang memasak lauk-pauk Sunda,Sari suka memasak karena mau menyenangkan keluarganya,Sari ngga pernah mau memasak saat tidak ada bahan makanan
Socio-religious aspect of life,"Sari ngaji sareng ngasih makan sampai sore hari, baru pulang ke rumah.","Euis ngasih air jeruk sareng daun jeruk, kemudian Euis sakit banget.",Euis teu bakat ngajal ka mandi sungsang,"Malahan, ucapan orang-orang ngomong, Euis ngasih kesehatan bagus sareng mengusir sakit",Awak Euis teu pengen bereksperimen ka mandi sungsang dina hari minggu,"Euis ngasih air mawar sareng daun sirsak ka tangki, kemudian ngadep ka tangki sambil ngucap pujian"
Socio-religious aspect of life,Budi ngasong ngadukung pujian kepada Tuhan,Sri ngasong ngucap pujian saképetan,Sri nunggal ingin mencari pujian orang,Sri nyobian mengasihi tuhan,Sri sering ngucap-ngucap pujian,Sri ngucap pujian kadang-kadang saképetan
Socio-religious aspect of life,Sri ngasong merasa senyum hati karep pujian Tuhan,Santosa ngasong ngucap pujian,Santosa ngadukung adat pepakaran,Santosa bakal ngajari wong kasucian,Adat pepakaran sering dijalankakeun,Santosa mengucap pujian kadang-kadang
Socio-religious aspect of life,Santosa ngasong merasa senyum hati karep budi daya Tuhan,Santi ngasong ngucap pujian Tuhan,Santi sedari-sedari ngadukung pujian Tuhan,Santi nyaritakeun pujian Tuhan kadang-kadang,Pujiian Tuhan sering dibacakakeun,Santi sering nangis karep pujian Tuhan
Socio-religious aspect of life,Santi ngasong merasa senyum hati karep pujian Tuhan yang saksi kebajikan,Dewi ngasong ngucap pujian Tuhan,Dewi nanggung ngadukung pujian Tuhan,Dewi nyaritakeun pujian Tuhan setiap hari,Pujiian Tuhan sering dibacakakeun,Dewi sering nangis karep pujian Tuhan
Food,Sari geus sakali nu jualan dina waktu pagi,Putri geus nyeri nangis dina kandang,Putri nagut ka kandang nu ayam,Putri geus nyeri nangis,Putri siagian kelapa muda,Putri ngajek-ngajek ka rumah
Food,Putri geus nyeri nangis dina rumah,Santosa geus manggawe suweng,Santosa nyeri rambutna,Santosa ngagelar suweng,Santosa teu manggawe suweng,Santosa ngajek-ngajek ka bangsal
Food,Santosa geus manggawe suweng dina waktu lewat,Adi geus nyeri ludah,Adi mangan sate ka rumah tetangga,Adi geus makan sate sakali,Adi ngajek-ngajek ka rumah,Adi teu nyeri ludah
Food,Wiro nganti-nganti kapalapa-palapa karep sate maranggi.,Sari geus mboten mending lapar.,Sari mangan nasi timbel ka pasar bandung,"Nasi timbel iki mangan sareng sayur bandung, ayu-ayunan nu ngendit",Sari geus nggawe pisan sayuran,"Sekel ma, nasi timbelna teu sisa"
Food,Sari nganti-nganti lapar sareng sayuran.,Surya geus mboten mending pedhang.,Surya mangan es doger ka jalanan nu bandung,"Es doger iki leunca maneh, kudu nu ditek",Surya geus nggawe pisan es doger,"Sekel ma, es dogerna teu sisa"
Food,Surya nganti-nganti pedhang sareng es doger.,Nana geus mboten mending nggawe lagi.,Nana mangan kue pancong ka rumah nu sunda,"Kue pancong iki mangan sareng teh poci, kangen nu ngendit",Nana geus nggawe pisan teh poci,"Sekel ma, kue pancongna teu sisa"
Food,Nana nganti-nganti nggawe teh poci sareng kue pancong.,Bima geus mboten mending nggawe lagi.,Bima mangan lumpia nu bandung ka acara adat,"Lumpia iki mangan sareng saus sambal, nikmat nu ngendit",Bima geus nggawe pisan saus sambal,"Sekel ma, lumpianya teu sisa"
Food,Euis ngejayanya arep kuwuh itu diterima baik oleh masyarakat.,Budi menutup warung kopi karena gagal.,Budi nyaeta kapala hiji usaha warung kopi tradisional,Ia mengambil resiko besar untuk mengembangkan usaha warung kopi itu,"Namun, Budi gak tau strategi marketing yang tepat",Warung kopi Budi gak mampu bertahan lama
Food,Budi belajar tentang strategi marketing dan mengembangkan usaha warung kopi itu dengan baik.,Sari gak bisa masak kuliner Sunda.,Sari mau belajar masak kuliner Sunda,Dia ngga punya pengalaman masak sebelumnya,Sari nyobain masak nasi timbel dulu,"Hasilnya gak enak, tapi Sari gak menyerah"
Food,Sari menjadi ahli masak kuliner Sunda dan membuka usaha catering kuliner Sunda.,Santosa gak bisa membuat kue kasenian Sunda yang enak.,Santosa mau buka usaha kue kasenian Sunda,Dia mengambil resep kue kasenian Sunda dari buku-buku lama,"Hasilnya gak enak, tapi Santosa gak menyerah",Santosa mulai mencari bahan-bahan alami yang lebih baik
Food,Santosa membuat kue kasenian Sunda yang lezat dan sehat dengan bahan-bahan alami.,"Fitri gak bisa membuat ""cincau"" Sunda yang enak.","Fitri mau belajar cara membuat ""cincau"" tradisional Sunda","Dia mencari resep di internet, tapi hasilnya gak enak","Fitri bingung, tapi dia gak menyerah","Fitri mencari tips dan trik dari orang-orang yang ahli membuat ""cincau"" Sunda"
