topic,correct_ending,incorrect_ending,sentence_1,sentence_2,sentence_3,sentence_4
Art,Déui Éka koyak pisan sarta dirampok,Éka kadatangan Éta kacapi ku balong,Dewi kawulaan Éka mangéndéng kacapi,Anjeunna paling kacapi dina balong Éka,Anjeunna oge kacapi ka bendhang Éka,Teu jarang Éka ngajual kacapi samua ka déui
Art,Éka bakat dipilih ku ngajual kacapi,Éka kadatangan Éta panggung ku siswo,Kawulaan Éka manganggo ka pesta siswo,Anjeunna geus panggawa siswoan Éka,Anjeunna oge siswoan Éka ka panggung,Teu jarang siswoan Éka dipuji ku kawulaan
Art,Éka dipilih ku panggawa siswoan Éta,Éka kadatangan Éta balong lauk ku bak,Misan Éka resep pisan ulin ka cai,Anjeunna paling resep ulin dina bak mandi,Anjeunna oge resep ulin ka balong lauk di imah Éka,Teu jarang manéhna asup ka balong lauk
Art,Éka koyak ku balong lauk ku bak,Déui Éka dijual pikeun nganti kain,Déui kawulaan Éka nanging pisan diletas,Déui kawulaan Éka nu kedah ngungsi ka kadangan Éka,Kawulaan Éka nu kedah ngungsi ka imah Éka,Déui Éka masih koyak nu bisa disalametkeun
Traditional Games,Euis teu jadi dérétan sutra pangajejetan,Euis henteu dugaan ka dérét sutra,Euis ngelencong ka dérét sutra dina hari raya,Euis ngasar-gasar melihat sutra-sutra baru,Euis nggawe sutra jangané nganti kagetan,Euis ngadeg ka dérét sutra sakan kaget
Traditional Games,Putri teh kasarung ngajari kasebutan karung ganteng,Putri teh kasarung henteu nikmati hari,Putri teh kasarung bermain karung ganteng dina hutan,Putri teh kasarung ngendak-ngendak ka karungan,Putri teh kasarung ngendak ka karung sampai tadah,"Putri teh kasarung nangis, karena hilang karungan"
Traditional Games,Éndog-éndog ngajari mahasiswa bakat gamelan,Mahasiswa teu mau ngamus gamelan,Sanggar éndog sambat konser musik tradisional,Éndog-éndog ngajar mahasiswa nganggo gamelan,Mahasiswa ngajari éndog-éndog mengenal gamelan,Éndog-éndog ngajar mahasiswa ngamus gamelan
Traditional Games,"Warganétra teu hilang inspirasi, wirawan ngajari kembali",Wirawan henteu ngajari warganétra,Wirawan ngajari warganétra seni bendi,Wirawan ngajari warganétra ngamus bendi,Warganétra ngamus bendi sakan wisma,"Warganétra nggawe bendi, karena hilang inspirasi"
Traditional Games,"Gadis-gadis teu khawatir, sayur gebus jadi lezat",Ibu-ibu ngasih sayuran lain,Gadis-gadis ngajari ibu-ibu memasak sayur gebus,Gadis-gadis ngasem-ngasem mengolah sayur,Ibu-ibu ngajari gadis-gadis mengulek sayur,"Gadis-gadis ngulek, karena sayuran terlalu panas"
Traditional Games,Sari mengerti nilai dari kata nyokap,Santi tidak bermain kelereng lagi,Adi dan Santi suka main kelereng di jalanan,Adi dan Santi mendapatkan bola kelereng yang berbeda warna,"Adi mengatakan, ""Seni kelereng ini hanyalah sekadar permainan, Santi",""" Santi marah, ""Adi, ini adalah seni tradisional Sunda!"""
Traditional Games,Adi mengenal arti seni kelereng,Dedi membeli engklek baru,Eko dan Dedi suka main engklek di tepi sungai,Dedi jatuh dan hilang engkleknya,Eko mencoba mencari engklek Dedi,"Eko gagal, ""Dedi, mainan itu hilang untuk selamanya"
Traditional Games,Dedi belajar untuk bijaksana,Putri membeli gasing baru,Putri dan Bayi suka main gasing di halaman rumah,"Putri memiliki gasing favorit, tetapi Bayi tidak",Putri mempersilakan Bayi untuk memainkan gasing favoritnya,Bayi merusak gasing Putri
Daily Activities,Ridwan ngajari sajéning kémit ka kakawin,Éka dilempar ka dinding sékolah,Sajenan Éka kémit ka léwur,Éta déngkeun pisan kémit ka sékolah,"Éka teu dina keunangkeun ka sékolah, pisan éta déngkeun kémit ka léwur",Éka ngasah sareng ngajak pisan ka bak mandi
Daily Activities,Éka ngajari kémit ka hérem,Dini nggojók kawung sareng ngombe,"Dina siang, Dini teu manggawek kagum",Dini mangéntak nyembak kawung,"Dina siang, koncina kawung sareng kémit ka kandang",Dini manggawek sareng ngajak pisan ka bale-bale Éka
Daily Activities,Dini ngajari kémit ka kagum,Bintang nangis karena nyerah kaséte,"Dina siang, Bintang manggawek kaséte","Ka onjeun, konci rada ngajak pisan ka cai",Bintang mangéntak kaséte sareng ngajak pisan ka bale-bale Dini,"Dina malam, koncina kaséte sareng buku-buku ka sékolah"
Daily Activities,Bintang ngajari kaséte ka kawula-wana,Suci guling-guling sareng kambing,"Dina sore, Suci manggawek kagetan",Suci mangéntak ngenéh sareng ngajak pisan ka cai,"Dina sore, koncina ngenéh sareng buku-buku ka sékolah",Suci ngasah sareng ngajak pisan ka bale-bale Éka
Daily Activities,Euis teu mangga ngapay ka anjeunna,Anjeunna ngasiis pisang sakai Santosa,Santosa manganggih ka sawah,Santosa ngagetik pisang sakai,Santosa ngulis mun anjeunna kagum,Santosa ngupay sareutik pisang sakai ka anjeunna
Daily Activities,Santosa teu mangga ngapay ka anjeunna,Anjeunna ngasiis bunga mawar Dewi,Dewi manggonggong ka pasar,Dewi ngagetik bunga mawar,Dewi ngutus mun anjeunna kagum,Dewi ngupay sareutik bunga mawar ka anjeunna
Daily Activities,Dewi teu mangga ngapay ka anjeunna,Anjeunna ngasiis kopi hitam Hendri,Hendri manggadeg ka warung kopi,Hendri ngagetik kopi hitam,Hendri ngupas mun anjeunna kagum,Hendri ngupay sareutik kopi hitam ka anjeunna
Daily Activities,Hendri teu mangga ngapay ka anjeunna,Anjeunna ngasiis durian Putri,Putri manganggih ka hutan,Putri ngadep mun singa,Putri ngutus mun anjeunna kagum,Putri ngupay sareutik durian ka anjeunna
Daily Activities,Putri teu mangga ngapay ka anjeunna,Anjeunna ngasiis ikan Dedi,Dedi manganggih ka sungai,Dedi ngadep mun ikan,Dedi ngutus mun anjeunna kagum,Dedi ngupay sareutik ikan ka anjeunna
Daily Activities,Dedi teu mangga ngapay ka anjeunna,Anjeunna ngasiis jagung Sari,Sari manganggih ka padi,Sari ngadep mun jagung,Sari ngutus mun anjeunna kagum,Sari ngupay sareutik jagung ka anjeunna
Daily Activities,Sari teu mangga ngapay ka anjeunna,Anjeunna ngasiis buah nanas Raka,Raka manganggih ka sawah,Raka ngadep mun buah nanas,Raka ngutus mun anjeunna kagum,Raka ngupay sareutik buah nanas ka anjeunna
Daily Activities,Raka teu mangga ngapay ka anjeunna,Anjeunna ngasiis baju Wira,Wira manggonggong ka pasar,Wira ngadep mun baju,Wira ngutus mun anjeunna kagum,Wira ngupay sareutik baju ka anjeunna
Daily Activities,Wira teu mangga ngapay ka anjeunna,Anjeunna ngasiis kue Sinta,Sinta manganggih ka krupuk,Sinta ngadep mun kue,Sinta ngutus mun anjeunna kagum,Sinta ngupay sareutik kue ka anjeunna
Daily Activities,Sinta teu mangga ngapay ka anjeunna,Anjeunna ngasiis rokok Budi,Budi manganggih ka kopi,Budi ngadep mun rokok,Budi ngutus mun anjeunna kagum,Budi ngupay sareutik rokok ka anjeunna
Daily Activities,Budi teu mangga ngapay ka anjeunna,Anjeunna ngasiis minuman Mia,Mia manganggih ka bakso,Mia ngadep mun minuman,Mia ngutus mun anjeunna kagum,Mia ngupay sareutik minuman ka anjeunna
Daily Activities,Kaarina nggawe siasat baca buku lebih cepat sareng temen-temennya.,Pak Santosa kenal banyak orang baru.,Pak Santosa meuli angkot ka kota,Pak Santosa teu mau ngasi transportasi lain,Pak Santosa tiasa mundur angkotan,Pak Santosa kenal anak-anak di jalanan
Daily Activities,Pak Santosa mendapat hati-hati dan hormat dari anak-anak di jalanan.,Bu Miayah mendapat harga murah.,Bu Miayah ngiring bakulan ka pasar,Bu Miayah teu mau beli bahan makanan sahur,Bu Miayah mau beli bahan-bahan makanan favorit keluarganya,Bu Miayah kenal para penjual pasar
Daily Activities,Bu Miayah berhasil membeli semua bahan makanan favorit keluarganya.,Bapak Jabar merasa lelah.,Bapak Jabar ngiringan kajengan ka rumah,Bapak Jabar ngiringan kajengan sareng anak-anaknya,Bapak Jabar mau ngaréngsékeun rumah agar rapih,Bapak Jabar suka ngajari anak-anaknya kajengan
Daily Activities,Bapak Jabar merasa bangga dengan kajengan rumah yang rapih dan menyenangkan.,Srikandi kaya rajanya.,Srikandi kasihan bakulan ka mama-mama pasar,Srikandi mau bantu mama-mama pasar,Srikandi bantu mama-mama pasar sampean sore hari,Srikandi kasihan bagaimana mama-mama pasar hidup
Socio-religious aspect of life,Sri ngadegé ku pamisané sareng mamakéan.,Dina dihentak ku pikulan karepéng galak.,Dina weton sae ngadegé ka mandala,Dina teu nyarakakeun ku tataké,Dina teu ngaco ku jeroan mandala,Dina sok ngawon-ngawon éta
Socio-religious aspect of life,Dina ngajari ku wiwitan mandala sareng mamakéan.,Dini diusir ku bale-bale karepéng sombong.,Dini ngadegé ka bale-bale,Dini kabari nunggal karo déui,Dini teu nyangka kodrat déui,Dini kudu daékeun kadungan déui
Socio-religious aspect of life,Dini ngadegé ku bale-bale sareng mamakéan.,Suci dihentak ku pikulan karepéng galak.,Suci ngadegé ka kucuran air mata déui,Suci kabari kodrat déui,Suci kadengan éta,Suci kajaat-kajaat karo déui
Socio-religious aspect of life,Suci mamakéan éta sareng déui.,Sari dihentak ku pikulan karepéng galak.,Sari ogé kajaat-kajaat ka pujian déui,Sari kabari nunggal ka déui,Sari teu nyangka kodrat déui,Sari kudu daékeun kadungan déui
Socio-religious aspect of life,Sari mencoba memahami kekhawatiran anak-anaknya dan memulai dialog mengenai keyakinan mereka.,Raka meninggalkan tugasnya dan memutuskan untuk meninggalkan desa.,Raka menjadi pemangku keagamaan di desa kecil,Raka selalu melaksanakan upacara setiap hari,"Di hari Minggu, Raka akan mengajak masyarakat untuk berdoa bersama","Namun, kehidupan Raka berubah saat masyarakat mulai tidak setia"
Food,Euis hoyong sambal menggeblok,Sari ngamet nasi tim,Sari énggoyong nasi tim,Sari makan di warung kelontong,Warung kelontong nggali di jalanan,Warung kelontong nuanggo sak siapakna euy
Food,Sari hoyong tempe orek,Dede ngamet kripik singkong,Dede pikiran kulintiran kripik singkong,Dede nyetakeun pasar,Pasar nu makanan ka bumi,Dede ngaseut ka kripik singkong
Food,Dede hoyong cabe rawit,Asep ngamet bakpia pathok,Asep mau beli jajan,Asep wongso bu Santi,Santi ngaseut ka jajanan Asep,Santi hoyong bakpia pathok
Food,Asep hoyong teh poci,Dian ngamet sate maranggi,Dian makan sate maranggi,Dian ngajual sate maranggi,Sate maranggi nuanggo kebo sapi,Dian makan sate maranggi sak buaya
Food,Dian hoyong sambal kacang,Eka ngamet kue bugis,Eka ngajual kue bugis,Eka wongso bu Dini,Dini ngaseut ka kue bugis Eka,Dini hoyong es doger
Food,Eka hoyong jahe teh,Ani ngamet pepes ikan,Ani suka makan pepes ikan,Ani ngajual pepes ikan,Pepes ikan nuanggo ikan lele,Ani makan pepes ikan sak kura-kura
Food,Ani hoyong sambal terasi,Santi ngamet bihun godog,Santi énggoyondong bihun godog,Santi makan di rumah makan,Rumah makan nu makanan ka bumi,Santi ngaseut ka bihun godog
Food,Budi dicari wong pasar karena barangnya enak.,Santi ngulek ka kamar tidur sore udah.,Santi geus ngulek ka perdéan kopi,Santi ngopi sampai sore,Santi ngulek ka warung mi,Santi ngulek ka rumahnya sore udah
Food,"Santi kaget ngulek ka rumahnya sore udah, banyak orang di warung mi.",Agus ngulek ka rumah tetangga.,Agus geus ngulek ka pangkenangan kana pikulan,Agus mau ngulek ka pangkenangan tetangga,Agus kaget nyata pangkenangan tetangga kosong,Agus ngulek ka rumahnya
Food,"Agus ngulek ka rumahnya, menyadari dia lupa bawa pikulannya.","Sari ngulek ka tani lagi, ngadegi kangkung.",Sari geus ngulek ka tani kana ngadegi kangkung,Sari nangis karena hujan deras,Sari ngulek ka warung ngareng,Sari mau ngulek ka rumahnya
Food,Eka mau ngajari teman-temannya cara bikin teh pisang ulih.,Sari teu mau makan bakakak teh lontong lagi.,Sari makan bakakak teh lontong,Sari ngagugat karena bakakak teh lontong jadi keras,Sari ngajari cara memasak bakakak teh lontong,Sari ngasih bakakak teh lontong kepada orang tua
Food,Sari ngajak orang tua makan bakakak teh lontong.,Santi teu mau makan sate maranggi lagi.,Santi makan sate maranggi dina jalanan,Santi nyangka sate maranggi karena enak,Santi ngagugat karena harganya mahal,Santi ngomong kepada teman-teman tentang sate maranggi
Food,Santi mau cari resep sate maranggi untuk dibuat sendiri.,Dedi teu mau makan kue kacang hijau teh es lagi.,Dedi makan kue kacang hijau teh es,Dedi nyangka kue kacang hijau teh es karena segar,Dedi ngasih kue kacang hijau teh es kepada teman-teman,Dedi ngomong tentang kue kacang hijau teh es kepada guru
Food,Dedi mau belajar membuat kue kacang hijau teh es.,Andi teu mau makan nasi timbel lagi.,Andi makan nasi timbel dina pasar,Andi nyangka nasi timbel karena lezat,Andi ngasih nasi timbel kepada saudara,Andi ngomong tentang nasi timbel kepada orangtua
Wedding,"Upacara kawin Mangsa dan Mbak Dina, ngadadak seru sakan sareng ngamen gamelan.",Mangsa nyandak ka kamar miring sareng ngumpulkeun hiasan tradisional Sunda.,"Dina hari upacara kawin, Mangsa manggeup saka kamar miring","Imah Mangsa dihiaskeun saka hiasan tradisional Sunda, sareng dipadukan sareng kentongan","Dina hari upacara kawin, keluarga Mangsa ngajak ngamen saka gamelan","Mangsa kawin bersama Mbak Dina, calon istri yang ramah dan bijaksana"
Wedding,Euis diwadani sareng Anwar kawin,Tika diusir ka luar imah,"Dina wedhanningan, Tika diadahar ka imah ngampak",Imah tiasa dipadan sareng hiasan,"Sekali wedhanningan selesaie, Tika ngesep sareng omongan ka pepadanan",Tika mau ngedep di tengah imah
Wedding,Tika dijompokeun ka tengah imah sareng nakama,Deden nyerah ka wedhanningan,"Wirahana nganti bajunya, Deden mau nyerah ka wedhanningan",Deden mboten mau dijompokeun sareng tradisi,"Ayatna mboten mau nyerah, mau dijompokeun sareng tradisi","Deden ngomong sakai Ayatna, ""Ndo' aku mboten mau nyerah!"""
Wedding,Deden mau dijompokeun sareng tradisi,Susana nyerah sareng nenek moyang,"Ninggal sareng nenek moyang, Susana mau nyerah ka wedhanningan",Susana mau nyerah karena ga suka dengan tradisi,"Susana ngomong sakai bibi, ""Ndo' aku mau nyerah karena ga suka tradisi!""","Bibi ngomong sakai Susana, ""Ndo' kene sareng nenek moyang, kawinan mamah diantara kita"""
Family Relationships,"Ida betenna sembuh, mbotenkeun wilujeng","Andri mbotenkeun jajaran badan, tapi kulawargana teu mbotenkeun pujanggaan",Andri sareng kulawargana teu bisa mangguli jajaran badan,Anjeunna ngirim pujanggaan kepada para ujarakeun,"Anjeunna teu nyambung manggeuk, karepakeun khawatiran damel nyambungan","Anjeunna pasrah kana kersa Gusti, ""Yén Allah, jadilah Tuhan hati ini"
Family Relationships,"Andri mangguli jajaran badan, kulawargana teu bakal nyambung pujanggaan","Santi ngamus kasebutan keluarganya, tapi keluarganya teu bakal nyambung","Santi di baceh, anjeunna nanggungin keluarga",Santi teu tiasa ningali keluarganya nganggo bumi,Santi teu ngamus kasebutan keluarganya,"Santi pasrah kana kersa Gusti, ""Yén Allah, jadilah Tuhan hati ini"
Family Relationships,"Santi mendekati keluarganya, keluarganya teu bakal ngamus kasebutan","Dewi hajat sareng keluarganya, tapi hajatna teu bakal nyambung","Dina hari raya, Dewi sareng kulawargana ngajalakeun ka tempat ibadah",Anjeunna ngajabat ibadah sareng keluarganya,Dewi ngajalakeun ka hajatan,"Dewi pasrah kana kersa Gusti, ""Yén Allah, jadilah Tuhan hati ini"
Family Relationships,Kapala hiji sakola maksa Éka asup kana organisasina.,Wiwit ngulangi kalakuan wong sipat.,Wiwit mamaké mardeka di jamanan Sunda,Wiwit sering ngajari kawula wong sipat,Wiwit ngasih kawula wong sipat latih mangéun cara hadap kehidupan,Indung Wiwit sok ngasih hargana katut wong sipat
Family Relationships,Wiwit jadi wong sipat yang terkenal di jamanan Sunda.,Ayu ngulangi kalakuan wong sipat.,Ayu dina urusan kawula wong sipat,Ayu sering ngadéngékeun jamanan Sunda,Ayu bakal mamaké kapala hiji kawula wong sipat,Ayu teu tiasa ngerti suka-duka wong sipat
Family Relationships,Ayu nengkeun wong sipat yang bijaksana.,Asep dibuang keluar dari jabangan.,Asep duduk ka jabangan,Asep sering ngajari kawula mamaké kapala hiji,Asep teu tiasa ngasih hargana katut kawula,Asep sering ngapung sareng gelut
Family Relationships,Asep nyaah pisan ka jabangan.,Sari ngulangi kalakuan kawula wanita.,Sari mamaké mardeka wanita di jamanan Sunda,Sari sering ngajari kawula wanita,Sari ngasih kawula wanita latih mangéun cara hadap kehidupan,Indung Sari sok ngasih hargana katut kawula wanita
Family Relationships,Budi jadi gumbira sarta eureun ceurik,Raden leumpang bari tuang otak goreng,Raden mamancang émbuak ka luwih,Kawula matak panggarep,"Raden matak kasurupan kawula, padahal ema geus nitah balik ka imah",Raden mawa paksa kawula
Family Relationships,"Sapanjang jalan ka imah, Raden nyoba ngabujuk kawula anu terus ceurik.",Buku-buku sakolana dijual pikeun meuli parahu karét,Perumahan Rina bakulaksa sakolana,"Kapaksa, kulawargana kedah ngungsi samentawis",Kulawargana ngungsi ka imah akina,Rina mawa sagala kaperluan sakolana nu masih bisa disalametkeun
Family Relationships,"Sanaos sababaraha bukuna baseuh, masih tiasa dianggo",Sadaya pengguna jalan kedah ati-ati,Dani geus tiga kali keuna tilang,Alesan ditilangna sarua tuluy,Dani tara nganggo sabuk pengaman,Ayeuna mobil Dani teu tiasa dianggo
Pregnancy and Kids,Euis ijab tanda tangan surat kontrak kerja dengan senyum.,Dina meninggal saat melahirkan.,"Dina, istri Sudarto, sedang hamil",Dina mengikuti tradisi Sunda yang menghormati ibu hamil,Sudarto membantu Dina dengan segala sesuatu yang dibutuhkan,"Namun, saat Dina melahirkan, terjadi komplikasi"
Pregnancy and Kids,Dina dan bayi dilindungi oleh para dokter dan Sudarto.,Tina memutuskan untuk meninggalkan Bima.,Tina dan Bima baru menikah,Tina hamil dan kedua pasangan sibuk menyiapkan persiapan untuk anak yang akan datang,Mereka mengikuti budaya Sunda yang menyambut anak baru dengan ceremonyal,"Namun, setelah beberapa bulan lahir, Tina merasa kecewa karena Bima sering melupakan kewajibannya sebagai ayah"
Pregnancy and Kids,Tina membicarakan masalah dengan Bima dan keduanya menemukan solusi.,Adi merasa kecil-kecilan dan sedikit bosan.,Agus dan Sari memiliki anak kecil bernama Adi,Agus dan Sari bekerja sebagai pekerja tani,"Setiap hari, mereka mengajarkan kepada Adi tentang budi daya dan nilai-nilai kehidupan","Namun, saat musim panen, mereka sibuk bekerja dan Adi sering ditinggalkan"
Pregnancy and Kids,Eka ngadeg gudangan ka alasanan ulih sintegala anaknya.,Sari nggeretan ka teduh kursi kursian saorang ibu hamil.,Sari nyantos ka kursi kursian saorang ibu hamil,Sari teu tiasa nggeretan,"Sari nyantos ka kursi kursian saorang ibu hamil, lalu nyacala ka teduh","Ibu hamil nu mamah sak siang, ""Sari, jangan nyantos ka kursi kursian saorang ibu hamil"
Pregnancy and Kids,Dewi ngambekakeun kawula anaknya ke tempat yang aman.,"Santosa ngomong-gomong ka anaknya, ""Kenapa kamu nu nggawe baca?""",Santosa nu mamah,Santosa nyaritakeun anaknya saorang anak betéh ka baca buku,Santosa nu ngadeg kawula anaknya ka baca bersama,"Santosa nu sadar, anaknya nu nggawe baca"
Death,"Budi teu tiasa nggerati angklung lagi, tapi kawula-wana tiasa ngadukung anak-anak musik.","Sri nggaweun ka korban, lamun korban mboten ngerti Sri.",Sri nau ampek ka bocah yang mati saat bermain di jalanan,Sri teu tiasa ngerti siapa korban,"Tapi, Sri mau ngasih tolong kepada korban","Sri nyusul ke rumah kakek korban, yang namanya Pak Suyat"
Death,"Sri ngasih tolong kepada korban, sareng Pak Suyat tiasa ngasih terima kasih Sri.","Pak Cokro ngasih uang kepada murid-murid, tapi dia terlalu banyak uang.",Pak Cokro ngerati sekolahan di desa,"Saat tahun baru, dia mau ngadepak kepada murid-muridnya","Namun, dia butuh uang untuk beli baju baru sareng cincin baru","Pak Cokro bertanya kepada suami dan istrinya, Pak Siswo dan Bu Wulan"
Death,"Pak Cokro ngasih uang yang sesuai, sareng Pak Siswo dan Bu Wulan mendukung kegiatan Pak Cokro.","Dinda ngasih uang kepada ibunya, tapi ibunya gak tahu asal usul uang itu.","Dinda sahur ke rumah kakeknya, Pak Supri",Dinda mau ngumpulin warisan kakeknya yang sudah mati,"Tapi, dia butuh ijin dari ibunya, Bu Siti",Bu Siti mau memeriksa apa yang ada di rumah Pak Supri
Death,"Dinda mengumpulkan warisan bersama ibunya, sareng dia mendapat pengetahuan tentang sejarah keluarga.","Siti mengungsi kepada tuhan, tapi dia gak percaya Asep akan mendapatkan senyuman.",Asep nikah dengan Siti,"Mereka berdua punya satu anak, yang namanya Adi","Namun, Asep mati saat Adi masih kecil",Siti mendoa agar Asep bisa mendapatkan senyuman di akhirat
Death,Pak Supriarto teu nindak sakabauhan kanggo wong kagetan.,Bu Miarya teu diletas oleh pengedar kain tirak.,Bu Miarya teu manggawe nu kain tirak,Bu Miarya teu nakoni amparan,Bu Miarya teu nanggapin sisir,Bu Miarya teu ngagasih jambangan
Death,Bu Miarya teu nindak amparan kanggo wong kagetan.,Pak Suryana teu diletas oleh pengedar kapala.,Pak Suryana teu manggawe nu kapala,Pak Suryana teu nakoni ampilan,Pak Suryana teu nanggapin sakabauhan,Pak Suryana teu ngagasih sampuru tembakau
Death,Pak Suryana teu nindak sakabauhan kanggo wong kagetan.,Bu Ayuningtyas teu diletas oleh pengedar jok.,Bu Ayuningtyas teu manggawe nu jok,Bu Ayuningtyas teu nakoni amparan,Bu Ayuningtyas teu nanggapin sisir,Bu Ayuningtyas teu ngagasih jambangan
Death,Bu Ayuningtyas teu nindak amparan kanggo wong kagetan.,Pak Gunarto teu diletas oleh pengedar saput.,Pak Gunarto teu manggawe nu saput,Pak Gunarto teu nakoni ampilan,Pak Gunarto teu nanggapin sakabauhan,Pak Gunarto teu ngagasih sampuru bajing
Death,Saikung ngasarakeun pepedon dina warung alam,Dewi nggeretakeun tumpeng kana tanah,Dewi teu resep kana tumpeng kembang golek,Dewi ngaco-ngaco tumpeng kembang golek kana peusijan,"Dewi lasi dina ngacoan tumpeng, sampeun saiki ngisi tumpeng tapi na bisa",Dewi nggeretakeun tumpeng kana peusijan
Death,Dewi ngajurakeun tumpeng kana meja,Euis nggeretakeun srananganana kana tanah,Euis teu resep kana srananganana,Euis teu jadih kagumakeun srananganana kana bocah-bocah,Euis bakal bala kana bocah-bocah sampeun saiki suwunakeun srananganana,Euis nggeretakeun srananganana kana bocah-bocah
Death,Suci ngasarakeun pakon dina rumah,Adi nggeretakeun tungganganan kana sunggingan,Adi teu resep kana tungganganan,Adi nggeretakeun tungganganan kana samping jalan,"Kurang-kurangan tungganganan, Adi nggeretakeun kana pedati",Adi nggeretakeun tungganganan kana pedati
Religious Holiday,Warganésa Kalapa Ngenung nyampeun sukah sareng ngasih terima undangan Yuda.,Anak-anak geus mboten mau mangan séruk Adi.,"Séruk sareng kecurigaan kagiatan warganésa, Adi ngajak anak-anak mangan séruk",Anak-anak saé nu mangan séruk éta sambungan séruk saé,Adi ngasih makan anak-anak éta kui bécak serta minuman segar,Séruknu diadakan sareng acara ngajalak-jalin sareng kompetisi kagiatan
Religious Holiday,Teman-teman nyampeun sukah sareng ngasih terima undangan Dewi.,Séuberan geus mboten mau mamangéstéun undangan Pangestu.,Pangestu mamangéstéun séuber- séuberan,Séuberan saé nu mamangéstéun séuberan éta sambungan séuberan saé,Pangestu ngasih makan séuberan éta sélédetan serta minuman segar,Séuberannya diadakan sareng acara ngajalak-jalin sareng kompetisi kagiatan
Religious Holiday,Adi ogé rajin ngadep hajat sak siapaké kagum,Sari ngahaja mindeng gering sangkan sahur nu pisan anjeunna,Sari mangan dua sahur,"Sahurna, Sari makan nasi uduk sak leunca",Sari kagum sahur sak leunca nu pisan anjeunna,Sari kadua makan sak leunca nu pisan anjeunna
Religious Holiday,"Ku kituna, Sari ogé hareup hajat makan sak leunca",Dani ngahaja mindeng gering sangkan ngajen sasakan nu pisan anjeunna,Dani ngadeg sasakan ka Mawlid,"Mawlidna, Dani ngajen sak sasakan",Dani kadua ngajen sak sasakan,Dani ngajen sak sasakan nu pisan anjeunna
Religious Holiday,Dani ogé rajin ngajen sak sasakan nu pisan anjeunna,Rina ngahaja mindeng gering sangkan ngajen sak sak siapaké,Rina ngajen dua syawalan,"Syawalannya, Rina ngajen bersama keluarga",Rina kadua ngajen sak sak siapaké,Rina kagum ngajen sak sak siapaké
Religious Holiday,Euis ngirim bakulan sabenan ke saudara-mara.,Dewi teu ngecet sahur.,Dewi teu ngadep ke tujuh hari sépi,Dewi geus ngantuk alahan ka sahur,Dewi sareng istri-beradadana teu ngobrol mangga,Dewi ngaji surah Al-Quran
Religious Holiday,Dewi sampun ngantuk ka sahur sareng berdo'a.,Prabu teu ngasih kado ngadegan ke orang lain.,Prabu teu nedepan ka pagelaran nglarbiran,Prabu teu nganti kawula-kawula,Prabu néplih kado ngadegan,Prabu ngaji surah Al-Fatihah
Religious Holiday,Prabu ngirim kado ngadegan ke kawula-kawula.,Sari teu ngasih sate maranggi ke orang lain.,Sari teu ngisi piringan santap,Sari néplih sate maranggi,Sari ngaji Al-Quran bersama keluarganya,Sari teu nganti tetangga
Religious Holiday,Sari ngirim sate maranggi ke tetangga.,Santi teu ngasih uang ke orang lain.,Santi teu nedepan ka hajatan,Santi nunggah-nunggah ke imah,Santi teu nganti saudara-mara,Santi ngaji surah Al-Ikhlas
Agriculture,Jagung Tia panen dengan sukses.,Hasil padi Budi gagal.,Budi mau menanam padi,Dia mendapat bantuan orang tua,Dia mengikuti tradisi tanam padi,Dia teu mengenal teknik budidaya modern
Agriculture,Budi panen padi dengan hasil yang baik.,Sari menyerah karena gagal membuat tempe.,Sari mau mengolah tanaman kedelai,Dia teu mengenal cara membuat tempe,Dia mencoba beberapa kali,Dia tidak berhasil mendapatkan hasil yang baik
Agriculture,Sari belajar cara yang benar membuat tempe.,Eko kehilangan uang karena tidak mendapatkan konsumen.,Eko mau menjual buah-buahan di pasar,Dia teu mengenal harga jual buah-buahan,Dia menganggap harga yang tinggi,Dia tidak mendapatkan konsumen
Agriculture,Eko menetapkan harga yang tepat dan mendapatkan banyak konsumen.,Dini menyerah karena gagal membuat minuman tradisional.,Dini mau meracik minuman tradisional,Dia mengumpulkan bahan-bahan tradisional,Dia teu mengenal cara membuat minuman tradisional,Dia mencoba beberapa kali
Agriculture,Rina teu loba napa nu yakinkeun iki sager,Éka diusir sakawungan kusabab singkong,Kawungan Éka kasohor ngantiar tanaman singkong,"Éka kadaleman bakul, Éka teu bisa ngantiar mangsa bakul",Suwarganda teu bisa ngantiar tanaman singkong,Éka mangadahar mamplé tanaman singkong nu bakul
Agriculture,Éka teu loba jalma anu nyaho yén singkong,Sayuran Budi dijual pikeun meuli parahu karét,Gedongan Budi kabupaten Bandung teu bisa ngantiar sawi,Suwarganda teu bisa ngantiar tanaman bawang,Gedongan Budi kasohor teu bisa ngantiar bibit sayuran,Budi mangadahar mamplé sayuran nu cukup jangkaukeun
